,Id,Url,Title,Selftext,num_comments,score
0,c1mtx9,https://www.reddit.com/r/academia/comments/c1mtx9/how_to_get_up_to_date_with_a_topic_you_have_not/,How to get up to date with a topic you have not visited in several years?,"Hello all,

&amp;#x200B;

This is something that has been in the back of my head for some time, but now that I have a concrete example, I would like to ask to more experienced researchers how do they do this. I'm a young researcher in neuroscience, and I wanted to write a blog post about conscious and automatic attention, and the process of automating parts of complex processes to free cognitive load.

&amp;#x200B;

As such, a particular attentional model (Normal and Shallice) comes to mind. The thing is, I studied this model almost 3 years ago, back in my masters, and I would like to update myself in case there are additions to this model to better explain this particular phenomenon, but what would be a good way of doing so? I hope the concreteness of the example does not in the way of the general question of how to update oneself.

&amp;#x200B;

Thank you very much in advance!",4,7
1,c1owk4,https://www.reddit.com/r/academia/comments/c1owk4/collaboration_in_academia/,Collaboration in Academia,"Hi Everyone,

I'm currently struggling with collaboration in my research organization. 

I have a number of older colleagues that I formerly collaborated with, but as the years have gone by, there is zero benefit for me to do so - they show up to discussions, add comments here and there, but don't actively do any work. It's partly the fact that they are incompetent with computers (which I have mild sympathies about) but also that they just can't be troubled to put in the time needed to even do traditional R&amp;D (theoretical work) where a computer is unnecessary. They all still use graduate students to ""get work done"" (I am guilty of the same) but I'm still keen to do work myself and not strictly delegate.

Am I being a prima donna in that I don't want to collaborate with such one sided arrangements, and is their argument of ""they did their time"" sufficient for me to accept their minimal contributions?",2,4
2,c1ply0,https://www.reddit.com/r/academia/comments/c1ply0/personal_and_professional_email_addresses/,Personal and professional email addresses?,"I’m a professor and like most people I have a professional email (@ my .edu) and a personal email (@gmail). Since my positions have been contingent for a while I’ve been forwarding all email to gmail, also so I have a single account to check and I can use mail forwarding to respond as my EDU address. However I have been itching to get away from gmail for a while, primarily for privacy reasons. But I’m a little nervous of using my personal domain because it might seem as kind of snooty by other academics. Ie. If I am firstname@firstlast.com or FL (first and last initials)@firstlast.com (since I’m on initial basis with students) I could see that working but it feels so... odd. Or I could just do firstlast@fastmail (or whatever other paid service I end up going with). What are thoughts?",5,2
3,c1s9yt,https://www.reddit.com/r/academia/comments/c1s9yt/should_i_share_my_first_authorship/,Should I share my first authorship?,"I'm a Ph.D. student in physics about to submit a paper for publication which has the potential to have a big impact. I am the project lead and in the later stages of the work had a good amount of help from a postdoc.

My advisor approached me today saying that although he acknowledges I did more of the work, the postdoc helped a lot, and putting in the ""equal contributor"" asterisk could help him with getting a good job on the future. My advisor asked me to consider doing this since he thinks it wouldn't hurt me and would be a ""net positive.""

I don't know what to do. I busted my ass for this paper so I'm feeling sour about sharing, but I recognize that's an emotional reaction and I should try to be logical about this. Academics, what would you do?",22,17
4,c6nta1,https://www.reddit.com/r/academia/comments/c6nta1/question_about_phd_in_europe/,Question about Phd (In Europe),"I've been doing a Phd but, for a variety of reasons (finance, supervisor, attitude of University) am considering stopping at that Uni. 

Transferring is difficult and I am not sure it's what I want to do (transfer) but I do know I want to keep on with my studies even under my own steam. One way or another I will produce a book out of my research. 

My question is: if this happened - that in the next years, I did complete what might be called an 'Independent Phd' then what are the possibilities regarding submitting it for consideration for a doctorate? 

Is it possible? Is it ever done? If yes, then what are the procedures, likelihood etc? Can anyone give any examples from their experience relating to this?",7,8
5,bxuzpp,https://www.sciencemag.org/careers/2019/06/racial-and-gender-biases-plague-postdoc-hiring,Racial and gender biases plague postdoc hiring,,1,30
6,bwk4qw,https://www.reddit.com/r/academia/comments/bwk4qw/seeking_instructors_any_field_any_rank_from/,"Seeking instructors (any field, any rank - from Adjunct and Grad Teaching Associate to Full Professor) for study","Hello all, 

I'm seeking instructors of any field and any rank to participate in a study examining the ways in which students impact the experience of instructors. The research has been approved by my institution's IRB. 

See below for the official recruitment script. 

\---

You're being invited to participate in a study meant to assess college instructor's perceptions of student behavior. You are being invited to participate in this study if you are over the age of 18 and currently a collegiate instructor of any rank. Participation in this study is completely voluntary. Your participation in this study will be kept confidential and anonymous. This means you do not need to participate and if you choose to participate you may stop at any time without fear of penalty. Should you choose to participate please follow the link below and follow the directions accompanying the online questionnaire. The questionnaire will take approximately 10-15 minutes to complete. If you have questions feel free to contact the principle investigator at the email or phone found on cover letter at the link below. Thank you for your consideration. 

[http://fullerton.qualtrics.com/jfe/form/SV\_0pvGbNw36almfd3](http://fullerton.qualtrics.com/jfe/form/SV_0pvGbNw36almfd3)

Should you know others who may fit the requirements for participation we encourage you to share this link.​​",0,2
7,bwrn65,https://www.reddit.com/r/academia/comments/bwrn65/do_you_find_male_professors_grade_higher_and_are/,Do you find male professors grade higher and are much nicer than female professors,"I have taken over 50 classes in college, and I noticed that my only C+ and few Bs were assigned by female teachers. I have also never had a female teacher congratulate me for the highest score on a test or a quiz, or for doing an exceptional job on an assignment, or ask if I can speak to them about a book during office hours (happens frequently with male professors). Additionally, female teachers never seem to like me. I think this is partly because I am quiet and soft spoken, so they think I am weak. I have been told to be more ""assertive"" by two separate female teachers and one spanish woman who taught french really hated me for some reason. When we learned the word ""witch"" in french, she pointed to me and said ""like her"" and played it off as a joke, but she was really rude and unfriendly so we were not friends who joked together. She also suggested that should not take a higher level of french, despite the fact she gave me a B in the class (even though I aced all the exams and she gave me a low grade on a subjective project). Meanwhile, male professors speak to me in a baby voice most of the time, so I guess they don't take me seriously since I look young and I am quiet. They seem to think I seem nice or feel sorry for me- I don't know. All I know is, I've never received below an A- in a class with a male professor, yet I have received many Bs and even a C with female professors. Almost half of them seem to dislike me as well. One even told me I would never be a nurse with my ""mouse-like"" temperament (when I was still considering nursing). Not to be sexist, since I am also female, but this is my experience.",14,0
8,bwt1qa,https://www.reddit.com/r/academia/comments/bwt1qa/starting_grad_school_in_the_fall_and_dont_know/,Starting Grad school in the Fall and don’t know what I’m doing,"*Not sure this is the best place to be asking this question - apologies if it isn’t*

I have been casually interested in Philosophy since my teenage years and reading on it quite a bit for the past almost decade.

About three years ago I started really zoning into a topic wrt my reading and thinking and as I got more into it I really wanted to go into a grad program for Philosophy to pursue this more academically. I found a grad program and started talking to their Director of Admissions. I took a couple of courses on the side at a nearby college, did well, and got recommendation letters. I applied to the grad program and got accepted to start in the Fall. 

In parallel, in the past few months I’ve found myself in the middle of a whirlwind of other really interesting topics, some closely related to my original area of interest, some only loosely related. 

The thing is that the people I’ve been talking to over the last several months are really intelligent, far better read than I am, and have mental models of many of these topics that have been making me half doubt my own prior mental models. 

More importantly, I’ve started doubting my own intellectual capacity and ability to pursue an academically rigorous discipline.

That brings me to my crossroads. What happened? I was so sure this is what I wanted and now I feel disoriented and unsure of what I’m doing. Should I just ignore all these other new areas of interest that have come into my life all of a sudden and return to the original area of interest and focus on just that?

I still really want to pursue the grad program, but I don’t know what to study or focus on. And I don’t know how to get through this comparison of self to others, which consistently results in self doubt. 

Appreciate any advice/guidance!

—

*Edit:*

*Thank you all for the support, thoughtful advice, and encouragement.*

*And especially for the solidarity.*",24,12
9,c0b0ah,https://www.reddit.com/r/academia/comments/c0b0ah/too_late_for_a_doctorate/,Too late for a doctorate?,"Hey all, 

I'm close to being 30 but have been out of university for about 5 years. The last degree was a research based Masters, but I've recently been thinking about going back to do a PhD as I love research and the idea of teaching sounds interesting to me as well. 

I also have been doing some research for career paths and frankly haven't seen many examples of top-notch professors and researchers who left academia for a significant period before going back to do a PhD. Most (99%) of them did their MS and PhDs together, followed by a Post Doc or something else. For context, my area of specialty is Electrical Engineering - in Signal Processing, Pattern Recognition, and Data Science. 

Does any of you know of any examples of the opposite? Alternatively, do you have any insights as to why transitioning to a doctorate so late in the game might have its problems?",12,11
10,bwc47g,https://www.reddit.com/r/academia/comments/bwc47g/rant_about_the_job_search_in_higher_ed/,RANT ABOUT the job search in higher ed,"I'm over this whole fucking thing. My friends and I went to a top R1 school, worked harder than anyone can imagine (well, you all can imagine), did our postdocs, moved to shitty places we hated, were RAs and Research Scientists, unemployed, desperate. Spent months on job applications, job talks, teaching demos. Appeared in conferences, pimped ourselves out, spent 4 days on (how many?) on-campus interviews lasting from 7am to 10pm, professionally responded to unprofessional inquiries into our personal lives, endured dirty looks and side eyes from arrogant professors for years. All for 4 people to show up to our job talks and a form E-MAIL 5 months after the fact telling us we weren't hired.

&amp;#x200B;

Not to mention the pestering of our already thinly worn reference relationships. Before we even knew we had gotten to that stage of the interview.

&amp;#x200B;

We are all $60K in debt, 20 pounds overweight, on antidepressants and anti-anxiety meds, without social support because we live - again - in shitty places. Everyone around us continues to cheerlead us that ""it's the career, not the place! The SCIENCE is what counts!""

&amp;#x200B;

I've just applied for my umpteenth job, written my umpteenth statement, and finally refused to add my references. Yeah yeah yeah I have a terrible attitude and how can I get a job with THIS attitude? My PI just called me unprofessional because I can't force my collaborators to collaborate. I've written 9 papers in the last 3 years, 1 of which was published. MY FAULT of course. I have a job interview tomorrow and just submitted 2 more job applications, but i'm burned out and ready to be homeless now.

&amp;#x200B;

Fuck. This. Life.",25,55
11,bwctt3,https://www.reddit.com/r/academia/comments/bwctt3/looking_to_interview_lollapalooza_festival/,Looking to interview Lollapalooza festival attendees (18-25) - $10 for 30 minutes phone conversation,"\*\*NEW POST 06/01/2019\*\*

&amp;#x200B;

We are looking to interview 5 people who have attended Lollapalooza last year, and plan to attend again this year. Also, you must have stayed in paid accommodations for Lolla. We want to understand your experiences of finding accommodations that fit your festival plans.

&amp;#x200B;

These are 30-minute phone interview (audio only). All collected interviews and identifiable data will be maintained confidential.

&amp;#x200B;

We are rewarding participants with a $10 Amazon gift card (sent via email). We have conducted 15+ interviews and have always paid.

&amp;#x200B;

Requirements:

\- Age 18-25

\- Live 100 miles outside of the greater Chicagoland area

\- Attended Lolla last year, and plan to attend again this year.

\- Personally booked and stayed in paid accommodations for Lolla last year, and booked paid accommodations for this year as well.

&amp;#x200B;

Book a time here: [https://calendly.com/chiresearch2025/festattendee](https://calendly.com/chiresearch2025/festattendee)",0,1
12,c3w3tz,https://www.reddit.com/r/academia/comments/c3w3tz/anyone_out_there_who_somehow_managed_to_get_into/,Anyone out there who somehow managed to get into academia with severe depression?,"I am new to academia and I got on via some kind of miracle or clerical error. Or who knows? Maybe my depression is a highly functional one. In any case, I'm a fucking idiot surrounded by some of the brightest and most intelligent people on the planet (chemistry and physics). They're a bit.... Let's say on their own and keep to themselves socially and now I'm trying to do research knowing nothing, not understanding what they're saying and making really stupid mistakes.

Does anyone else experience this? Is this just ""Peters principle"" in action?

Tl;dr: somehow found my way into academia even though stupid, antisocial and depressed, anyone else?",12,4
13,c3wgs9,https://www.reddit.com/r/academia/comments/c3wgs9/is_officially_reviewing_papers_a_good_thing_to_do/,Is officially reviewing papers a good thing to do?,"I keep on getting requests for reviewing papers from places like IEEE Access, and I wonder if it is worthwhile spending effort on them. I am a 2nd year PhD student, very fresh into my research so I am not aware of the state-of-the-art developments in the recent years to judge the contribution or weight of a paper. Also sometimes the area of the paper doesn't exactly overlap with mine, so that makes me a bit uncomfortable while reviewing me.

&amp;#x200B;

So is there any pros to spending time and effort on it ? 

&amp;#x200B;

P.S. My advisor asks me to do informal reviews of papers that are supposed to be reviewed by him all the time, and it is a really tiring work, so I would like to know if I can reject all other requests to review.",5,10
14,c3r1a1,https://i.redd.it/q8atec2tfx531.jpg,As if I don’t actively have research to do during the summer. Lololl,,4,84
15,c3tkjw,https://splinternews.com/the-revenge-of-the-poverty-stricken-college-professors-1835381061,"Adjunct faculty as working poor - academia is ripping everyone off, and everyone suffers. Article about adjuncts uninionizing.",,3,9
16,c5ygya,https://thetransmetropolitanreview.wordpress.com/2019/06/26/the-return-of-fulvia-ferrari-or-a-brief-history-of-cybernetics/,A Brief History of Cybernetics,,0,0
17,bxcq3e,https://www.reddit.com/r/academia/comments/bxcq3e/how_do_i_find_current_university_teachers/,How do I find current university teachers' research papers on academia website?,,1,0
18,bvv9fu,https://www.reddit.com/r/academia/comments/bvv9fu/so_im_about_to_speak_at_a_conference_knowing_my/,"So, I'm about to speak at a conference knowing my research is wrong... Any advice.","Hey, currently doing my PhD.   
I've been invited to speak at an international conference about something semi-related to my PhD, but not the PhD itself..   


The conference is a month away and after doing more research, I have come to the conclusion that my research is incorrect. However, I am certain that nobody will be able to detect this unless they do the research themselves. Unless you fact-check my data, you wouldnt pick up on the flaw..  


Im opting to go through with the talk, answer questions without referring to the error and then dropping the subject matter entirely. 

&amp;#x200B;

What do you guys think? People must present incorrect data at conferences. The big difference being that I know my data is incorrect.",15,24
19,bvybpv,https://www.reddit.com/r/academia/comments/bvybpv/perception_of_ma_in_medical_field_as_unscientific/,"Perception of MA in medical field as ""unscientific"", best way to address this?","I am currently in medical school, and did a master's in neuroscience (specifically neuroimaging) before starting. For historical reasons, my university awards an MA for this field rather than an MS, even though my entire degree program was identical to what would be considered an MS at another university. Already I am encountering some confusion about why I have an MA, since some people jump to the conclusion that it is only in humanities-type fields (I'm not big on credentialism, but it is common to list a master's degree after your MD on posters, etc. since most medical students do not have an advanced research degree).

How should I get around this? I've thought about just listing it as an MS, since all I did during the degree was ""science"", and maybe avoiding the confusion would justify this ""white lie"" (but this could potentially come back to bite me). If not this, any other ideas?",7,1
20,bvwouy,https://thegradient.pub/over-optimization-of-academic-publishing-metrics/,Goodhart’s Law: Are Academic Metrics Being Gamed?,,2,5
21,c7bdnp,https://www.reddit.com/r/academia/comments/c7bdnp/looking_for_feedback_from_those_who_have_entered/,"Looking for feedback from those who have entered into or completed a multi- disciplinary Masters or Ph,D. How common is this? What were the major roadblocks? Are there common disciplines that are often linked together?",I am also interested in post-graduate studies that engage multiple academic institutions. Is cooperation and collaboration amongst various universities more encouraged within a certain group?,11,16
22,c7cuk8,https://www.reddit.com/r/academia/comments/c7cuk8/bibliographies_formal_requirement_or_essential/,Bibliographies: Formal Requirement Or Essential Ingredient?,"We all know that putting together a bibliography can seem like a tedious chore. So much so that many scholars leave it for the very end of their research. 

But the bibliography is not just a formal requirement of academic editing; it is an important ingredient of a good piece of scholarship. 

This article will help you compile a bibliography that demonstrates your expertise to your readers, and tips to ease the writing process:

•        How to record crucial bibliographic information as you go  
•        How to use technology to automate citations  
•        How to format your citations to a journal's styleguide  
•        How to best work with an academic editor

Visit us at [Academic Language Experts](https://www.aclang.com/blog/the-bibliography-formal-requirement-or-essential-ingredient/) for the full article and more tips and tricks.",1,0
23,c7fat6,https://www.reddit.com/r/academia/comments/c7fat6/joined_a_project_with_a_colleague_far_my_senior/,"Joined a project with a colleague far my senior, he isn't delivering anything and I have done everything",[deleted],4,8
24,by25zh,https://www.reddit.com/r/academia/comments/by25zh/im_done_collaborating_i_think/,"I'm done collaborating, I think.","I know that collaboration is the fastest way to get lots of articles published, but I have had several situations where I've been burned by people dropping out of projects or taking an excruciatingly long time to work. I really think I can keep a better pace if I publish everything sole author. Does anyone here just not collaborate? If so how is it working out?

ETA: I'm in humanities/social sciences",13,16
25,by3ct8,https://www.reddit.com/r/academia/comments/by3ct8/who_is_an_economist/,"Who is an ""economist""?",[deleted],10,2
26,c2nqve,https://i.redd.it/tjnag0hw3e531.jpg,OK Reddit. Is this a legit organization?,,6,4
27,c1c22x,https://www.reddit.com/r/academia/comments/c1c22x/admission_to_graduate_programmes_with_open/,Admission to graduate programmes with Open University (UK) degree,"Hi all,

Just wanted to ask this question as I think I’m in a bit of a unique situation.

I’m 26 and have just completed the first year of a Natural Sciences BSc degree with the Open University (UK), a distance learning university.

I have already a Bachelor of Laws (good ranked UK uni) and Master in Management from a similarly ranked (~top 10 uni) in France.

After working in business and law I found it wasn’t what I wanted to do, and remembering my old dream to become a zoologist, I decided to save money and pursue a Open University distance Bachelor in Science, with a view to volunteer and work in conservation at the same time internationally whilst studying towards my degree.

At the same time, I can’t help but wonder if, when I apply to a graduate programme for science, admissions might see my Open University degree differently compared to applicants with more conventional backgrounds.

Do you think admissions will have a problem with my background? Thinking of applying to Masters in Ecology/Zoology with a view to working in research.

Thanks,

Leo",3,4
28,c15yt0,https://www.researchgate.net/publication/330295492_Encountering_relatable_information_in_experiential_learning_spaces_A_partnership_framework_for_research_information_specialists_and_early_career_researchers,"Encountering relatable information: A new empirical model for engagement between early career researchers, mentors, non-academics and information specialists, through shared understanding of informed learning, can result in higher quality research and impact towards social innovation.",,0,3
29,c1ejk8,https://www.researchgate.net/profile/Vinu_Arumugham2,A researcher that claims Vaccines cause autism and a myriad of other autoimmune diseases. How can ResearchGate allow such nonsense to be given a platform and be posted?,,7,15
30,c0ejx1,https://www.reddit.com/r/academia/comments/c0ejx1/gre_exam/,GRE Exam,"Hi everyone !

How useful is the GRE for the academic career / research /daily academic tasks ? 

it's not required in my country but i'm wondering about the intrinsic value of it's study material. 

thanks you !",4,4
31,c0kyip,https://www.reddit.com/r/academia/comments/c0kyip/is_this_a_good_reason_to_appeal_a_decision_to/,Is this a good reason to appeal a decision to reject a manuscript?,"The journal I submitted to sent my paper out to two reviewers. One liked it, the other hated it. The editor decided to reject. I've done some reading on when it is appropriate to appeal an editor's decision to reject and many essays on the matter refer to evidence of bias on the part of a reviewer. I'm not sure if this is bias or what, but the reviewer who hated it seemed to fundamentally misunderstand the nature of the research. They approached the paper from their own discipline (human geography) and didn't appear capable of understanding that the paper was not meant to contribute to human geography. They applied standards of scrutiny to the methods that were totally inappropriate given the purpose of the paper and the nature of the results. They also admitted to not even reading past the results section (to not bothering to read the discussion section or conclusion). 

Is that worth appealing? Or can I trust that the editor would have read the paper too and been the arbiter since one review was positive and the other negative? I also have no publication history, so maybe that played a part too. 

But is what I described a strong reason to appeal?

edit: also, how long should an appeal letter be?",6,2
