,Id,Url,Title,Selftext,num_comments,score
32,c0l1zj,https://www.reddit.com/r/academia/comments/c0l1zj/should_i_complain_to_academic_department_chair/,Should i complain to academic department chair?,"I got quite screwed over, didnt get my degree when i should have, resulting in submitting false resumes and consuming my school loan grace period. 
Im thinking about sending this email, but the degree issue is resolved, and i will officially graduate soon, so im worried they could change their mind and decide i shouldnt graduate

Here is the email:

Hello [chair],


I have an issue and the registrar directed me to you.

To make a long story short ill use bullets:


- In November 2018, i applied for graduation after fulfilling all requirements

- I've been receiving ""congrats grad"" emails and never received rejection emails

- I applied to jobs for about 7 months

- I found out i did not graduate, so many of those companies have likely blacklisted me for accidentally having a false resume

- I raised the graduation concern to Professor [X], [old academic advisor], and Professor [Y] (during a point of advisor transition)

- It was found that indeed fulfilled the requirement


However, now my grace period for my student loans is expired because i dropped full time status back in December 2018, despite only receiving my degree soon. I contacted FedLoan servicing, and they said if i can provide written proof of enrollment or proof of a special circumstance, then they can adjust my grace period. Could you perhaps do me the world of a favor and write such a document outlining this circumstance?

End email


 (Would they really want to admit fault??)
The only ammunition they have is that i asked my advisor if i graduated several times and never heard a reply. She did tell me that i have not graduated, but not in a reply, rather in a separate email amidst a ton of spam, so i did not see it

Should i send this email?",18,3
33,c0myba,https://www.reddit.com/r/academia/comments/c0myba/how_to_become_a_full_time_instructor/,How to become a full time instructor?,"I have a BS in secondary mathematics education and an MA in Mathematics with the goal of becoming a full time community college instructor. I have two years experience as a graduate teaching assistant. Two instructor positions were available and I did not get an interview for either. My question is, what can I do to get an instructor position in the future? Is getting more experience by being an adjunct the thing to do at this point? Are there other things I need to being doing to make myself a better candidate?",5,0
34,c0n2lc,https://www.reddit.com/r/academia/comments/c0n2lc/must_read_books_for_academics/,Must read books for academics,"Hi everyone , do you have any book recommendations regarding the academic life/writing/careers ?",9,9
35,c0nh3n,https://www.reddit.com/r/academia/comments/c0nh3n/resources_for_reviewing_papers/,Resources for reviewing papers?,"Hi guys, I'm currently in training for a research assistant post at my university (I'm currently studying a master's degree) and they've given me a critical appraisal task as part of my training. Does anyone have any books or resources that would be useful?",2,2
36,c0qfsy,https://www.reddit.com/r/academia/comments/c0qfsy/phd_student_seeking_fulltime_faculty_in_the_us/,PhD Student Seeking Full-Time Faculty in the US for Survey!,"Hello!  Apologies for cross-posting across threads. My name is Becca Clancy  and  I am a PhD student at Colorado State University in the Psychology department. I am currently recruiting participants for a survey about   occupational stress and work/life experiences, ***specifically among professors in college and university settings***. The online survey ([***https://colostate.az1.qualtrics.com/jfe/form/SV\_b8HAlB4QSPfERlb***](https://colostate.az1.qualtrics.com/jfe/form/SV_b8HAlB4QSPfERlb)) is entirely anonymous, and it should take 20-30 minutes to complete. *If you choose to take the survey, you may be eligible to win one of multiple* ***$50 gift cards*** *to Target or Amazon!*

Due to my population of interest, I am heavily relying on email, social media, and snowball sampling to disseminate my research. I would *greatly appreciate* it if you could share this post with any friends and colleagues who  may  be interested! If you have questions or concerns about this  project, please feel free to contact me at [rclancy@rams.colostate.edu](mailto:rclancy@rams.colostate.edu).",4,1
37,c0gxqe,https://www.reddit.com/r/academia/comments/c0gxqe/the_importance_of_literature_review_in_research/,The Importance of Literature Review in Research Writing,[removed],0,1
38,c5b88u,https://www.reddit.com/r/academia/comments/c5b88u/what_is_the_best_way_to_kick_start_employment_in/,What is the best way to kick start employment in academia?,I was just hoping for some tips? I am doing my MA in religious studies (I'm on track for a distinction) and will hopefully be starting my phD in the next two years. Is there anything i can do alongside my studies to help gain employment as a researcher or lecturer?,11,6
39,c0sqgm,https://www.reddit.com/r/academia/comments/c0sqgm/looking_for_advice_for_a_tacky_issue/,Looking for advice for a tacky issue.,"I have applied for a PhD scholarship and have successfully gotten it. The problem is, my intended PhD supervisor was not approved by the scholarship board of directors. The directors insist I would have to change a supervisor if I were to take up their scholarship. 

I felt bad having troubled my intended supervisor because he had sat down with me to talk about the PhD projects and also linked with up with a co-supervisor. And after all that I have to break it to him that I’ve gotten the scholarship but he cannot be my supervisor. 

What would be the best way I could resolve this? If you’re the “intended supervisor” and this situation were to happen to you, what would you hope the student do first? How can I put these in word nicely? 

Thank you so much.. any advice is welcome..",3,4
40,c0wqjx,https://www.reddit.com/r/academia/comments/c0wqjx/applying_for_a_lecturer_position_in_the_uk_what/,Applying for a Lecturer position in the UK: what should I know?,"Hi there, I've recently applied to a position in the UK and I've got an interview coming up (great). Thing is, I'm not from the UK and have only the vaguest idea about whether teaching/researching there is substantially different from what I'm used to (namely, the French system). Exchanges with the University were laconic at best on this matter -- and the blurry perspective of Brexit raises questions concerning the employability of EEA nationals that they could not answer (not blaming them, who can?). On the one hand I feel qualified and interested and this would be an interesting career opportunity; on the other hand I'm not sure what I'm getting into and whether I should expect something completely different.

&amp;#x200B;

What should I know about the UK academic system, to hopefully make it through the interview? Should I worry about some things in particular (teaching hours, expectations, politics...)? Any advice you can give me would be hugely appreciated!",7,6
41,c103mr,https://twitter.com/uolj4w/status/1139857638454251522?s=21,University of London forcibly removes protestor with private security,,2,10
42,byo9mo,https://www.reddit.com/r/academia/comments/byo9mo/what_is_the_easiest_field_to_get_a_tenure_track/,What is the easiest field to get a tenure track position in?,"Out of curiosity, since it’s so hard universally for most fields anyways",14,0
43,bylkrf,http://www.chroniclet.com/Local-News/2019/06/07/Gibson-s-Bakery-v-Oberlin-College-More-than-11-million-awarded.html,Gibson's Bakery v. Oberlin College: More than $11 million awarded,,2,24
44,bym3jm,https://m.youtube.com/watch?v=YnQZHjCODEw—,Experiment in patient-led peer review,,0,2
45,bz1sn3,https://www.reddit.com/r/academia/comments/bz1sn3/at_which_late_stage_of_phd_do_students_move_to/,At which (late) stage of PhD do students move to postdoc jobs or other jobs?,"People often say, when they finish their PhD, they start to do a postdoc or another job. But what do they mean by 'finish their PhD'?

I use to think PhD students start a job after they submit the thesis but before the viva, but lately I heard someone moved to a postdoc position without finishing writing his thesis! Is this common? Do people just start their job when the job is supposed to start, regardless of whether they finish their writeup? Or is it just that after they complete all the experiments, they can leave as they wish? 

By the way, I'm a science PhD student in the UK.",8,1
46,bz1b39,https://www.aier.org/article/astonishing-mess-academic-publishing,The Astonishing Mess of Academic Publishing,,5,22
47,byxg3s,https://www.reddit.com/r/academia/comments/byxg3s/ethics_of_sharing_about_fieldwork_on_social_media/,Ethics of sharing about fieldwork on social media,[deleted],0,1
48,c20pu8,https://www.reddit.com/r/academia/comments/c20pu8/i_wrote_back_to_a_predatory_publisher_and_its/,"I wrote back to a predatory publisher … And its ""editorial assistant"" replied","When I got the latest barely legible email from an “editorial assistant” named “Nicholas Wilson” at a journal unknown to me … 

&gt;Universal Journal of Public Health (Editor-in-Chief: Prof. Fatma Hassan) is an international, open access, peer reviewed journal. Till now, 7 volumes including 40 issues have been published. We read the abstract of your article entitled I Give All My Papers Great Titles and are very interested in your article presented in XVI International Congress on Great Titles. If the full text was not published, please send us an extended version for publication in Universal Journal of Public Health(ISSN: 2331-8945) via email at [conference@horizon-publishing.org](mailto:conference@horizon-publishing.org). You are also invited to submit other original research papers to the journal.

… I wrote back. 

&gt;Dear Nicholas,   
&gt;  
&gt;I see that Horizon Research Publishing is named on all the reputable lists of predatory journals. Of course, this is exactly what I expected after reading the flagrantly poor writing used to decorate your email to me and the likewise unimpressive HRP website.   
&gt;  
&gt;If your business model is conning enough people to be successful, you'll have no use for my reply. If you wish to con more people, however, you'll need a much better editor and a much better marketing team than you have now.   
&gt;  
&gt;Sincerely,   
&gt;  
&gt;lashend

Here’s how “Nicholas Wilson” replied … 

&gt;Dear lashend,  
Thanks for your suggestion.  
  
&gt;  
&gt;1. Such a website cannot be maintained by only one person. Jeffrey Beall is just a librarian.   
Hence the maintenance and operation are beyond his ability. A similar forum can be created by   
any groups. Without the financial support, it is impossible for one website to appear on the   
first page of Google.  
  
&gt;  
&gt;2. Many open-access publishers are listed there. The negative information may be removed if a   
large sum of money is paid by publishers.  
  
&gt;  
&gt;3. We're a non-profit organization. The publication fee varies from $200 to $290 for one   
manuscript accepted for publication. Compared with the publication fee charged by conventional   
publishers, it's cheap. Especially, a waiver policy is offered to many authors from low-income   
economies. Naturally, we are slandered by these powerful competitors. Nevertheless, thousands   
of articles have been released on over 1000 issues.  
For more information, please visit journal's homepage.  
[http://www.hrpub.org/journals/jour\_charge.php?id=76](http://www.hrpub.org/journals/jour_charge.php?id=76)  
  
&gt;  
&gt;4. To maintain the reputation of our journals, we have implemented a rigorous peer review. Only   
after clearing the peer review process is one manuscript accepted for publication. The   
editorial board for all journals has been posted online. With 55 journals and over 5000   
renowned experts, we are serving for over 100000 authors.  
e.g.:  
[http://www.hrpub.org/journals/jour\_reviewers.php?id=76](http://www.hrpub.org/journals/jour_reviewers.php?id=76);  
[http://www.hrpub.org/journals/jour\_reviewers.php?id=93](http://www.hrpub.org/journals/jour_reviewers.php?id=93);  
[http://www.hrpub.org/journals/jour\_reviewers.php?id=96](http://www.hrpub.org/journals/jour_reviewers.php?id=96);  
[http://www.hrpub.org/journals/jour\_reviewers.php?id=95](http://www.hrpub.org/journals/jour_reviewers.php?id=95);  
[http://www.hrpub.org/journals/jour\_reviewers.php?id=21](http://www.hrpub.org/journals/jour_reviewers.php?id=21);  
  
&gt;  
&gt;5. Based on the Jeffrey Beall's own assumptions, it's incredible that over 500 publishers in   
his list are predatory ones. What is his expertise remains unknown. Probably he is a genius in   
all academic disciplines like mathematics, physics, chemistry etc. All contents in Scholarlyoa   
are full of syntax errors. Even the name Scholarlyoa is a word created by his own imagination.  
  
&gt;  
&gt;6.Our journals have been indexed by some bibliographic databases (e.g. SCOPUS, EconLit, EBSCO   
A-Z, NSD - NorwegianCentre for Research Data, NLM Catalog, CABI full textetc).  
  
&gt;  
&gt;Five journals (Universal Journal of Mechanical Engineering,Universal Journal of Electrical and   
Electronic Engineering,Universal Journal of Educational Research, Civil Engineeringand   
Architecture, Mathematics and Statistics) have beenindexed by SCOPUS.  
  
&gt;  
&gt;Four journals (Advances in Economics and Business, UniversalJournal of Accounting and Finance,   
Universal Journal ofIndustrial and Business Management, Universal Journal ofManagement) have   
been indexed by EconLit.  
  
&gt;  
&gt;Besides, ""Linguistics and Literature Studies"" has been indexed by Linguistics Abstracts   
Online.""Universal Journal of Agricultural Research"" has been indexed by CABI full text and   
""Universal Journalof Public Health"" has been indexed by NLM Catalog.  
  
&gt;  
&gt;For more information, please visit the indexing page of the relevant journal.  
  
&gt;  
&gt;Overall, this person benefits from the following aspects:  
1. The negative information may be removed if a large sum of money is paid by publishers listed   
there.  
2. By defaming open access publishers, he will receive the reward from conventional publishers.  
3. We only focus on the assessment from governmental agencies and authoritative agencies in the   
industry. Any individual statements for commercial purposes will be ignored.  
  
&gt;  
&gt;Best Regards  
  
&gt;  
&gt;Nicholas Wilson  
Editorial Assistant

&amp;#x200B;

Looks like I'm not the only one to have ""written back"" ... !",9,41
49,c21ymp,https://www.reddit.com/r/academia/comments/c21ymp/advice_on_rejecting_a_review_paper/,Advice on rejecting a review paper?,"I am a post doc and have only been asked to review 3 papers so far, all of which were primary studies that I thought had sound methodology, authors drew reasonable conclusions, etc so I recommended to accept with major/minor revisions. Recently, I was asked to review a paper and the title sounded interesting so I accepted. Upon receiving the entire document, I realized it was a review paper but I decided to still accept because I need to be able to do these things at some point and I was up to the challenge! 

However, this shit is awful.  There are two authors - a post doc and an MD. Clearly, the post doc is not a native English speaker (I know who the MD is and he is a well published native speaker), so its clear that the last author didn't even bother to read this before submitting. Some paragraphs (mainly the intro) are really well written, but most of it is riddled with typos and randomly organized, hard to interpret text. However, none of this is my big issue. All of this could be fixed with some proofreading and I don't feel people should be penalized for writing in a second language - I could never achieve that. 

My problem is that it is literally just a review of existing studies and random facts. Its like a textbook of random facts and at no point whatsoever do the authors postulate or synthesize anything. This would be a great bibliography resource for a new student or something, but the authors don't provide any interpretation, suggestions of a path forward, etc. So my gut is telling me to reject this paper, but I'm suffering from ""Who am ***I*** to reject these people"" and nervous about doing so. I'm trying to write up my review now and I don't know how to phrase things. Its not a structured review, just a place to write to the editor and a place to write to the authors. 

**Does anyone have suggestions for how I should phrase this rejection?** I feel like I really need to justify a rejection strongly, so I want to list 1) no synthesis of new ideas or information and 2) there are several other reviews recently published on this topic that did it way better, so these authors need to add something beyond what those other reviews did (which they did NOT). Is that enough to reject a review paper?",12,5
50,c25jdc,https://www.reddit.com/r/academia/comments/c25jdc/not_enough_teaching_experience/,Not enough teaching experience,"I'm working full time so am in a part time PhD that offers classes at 5 or 5:30 pm.  Most of the jobs I see require teaching experience, but I was told I only have one semester where I do an 'internship'.  Any advice on how to get more?",6,9
51,c26ys6,https://www.youtube.com/watch?v=ZtWkGfKhsG8,We summarized every chapter of the Wealth of Nations by Adam Smith. Here's chapter 1!,,0,0
52,c4i3i0,https://www.reddit.com/r/academia/comments/c4i3i0/any_fulbright_scholars_with_tips/,Any Fulbright Scholars with tips?,"Hey there!


I’m currently applying for a Fulbright to obtain a Masters degree. Does anyone have any tips or experience with the application? I really want it but I keep getting in my head about what “they” want to hear. 

Any advice would be very much appreciated. 

Thanks!",4,6
53,c4k8ih,https://www.reddit.com/r/academia/comments/c4k8ih/is_the_world_of_academia_right_for_me/,Is the world of Academia right for me?,"Hi all!

I am a recent graduate with a B. S. in psychology. I literally had my ceremony last weekend and now that all the graduation magic has died down I am still unemployed and confused about my career.

I am considering giving it my all, saving up for grad school, and then pursue that doctorate in Psychology I’ve been longing for since undergrad. 

I just don’t know if it’s the right path for me. Ever since I was a child, I have had a myriad of “dream jobs” and “career goals” that I just could not stick with. During my time in undergraduate school, I fell in love with the environment. I loved the campus. I loved the feeling of knowing you are surrounded by people striving towards the same goal. And the respect I had for my professors! 

I am just weary about this longing of mine to commit to graduate school. I had straight A’s up until my senior year—I had/been having a terrible bout of depression and just a lot of existential crises—and I’m just trying to recover from that. I’m also kind of weary as the last year or two of college I began to develop a more reclusive state as my depression set in. Losing my presidential position at an Honors fraternity, quitting my research position, and the decline of my connections to graduate students and professors. Basically I graduated in a really bad state. 

Now I feel the void that is no longer having my name actively enrolled in a large institution. I miss research and I miss not only learning, but actively thinking and understanding concepts and information not many care to appreciate. 

The way faculty worked and lived at my school was very interesting; it seemed like professors devoted most of their lives to their discipline. They definitely take work home. And I think I like that! But I don’t know if that is right for me. And it makes it all the harder a choice now that I’ve moved back home and am away from campus.",4,2
54,c4n5dz,https://www.reddit.com/r/academia/comments/c4n5dz/end_of_3_year_probationary_period_review_meeting/,End of 3 year probationary period review meeting tomorrow - wish me luck!,"I'm on an indefinite/permanent lecturing contract. I feel very lucky as I know these positions are hard to secure.

My ridiculously long probation period is up soon and I have a formal meeting about this tomorrow with the head of department who then makes a recommendation to the Dean about whether or not I should keep my job.

I feel I've performed very well overall but haven't produced near as many papers as the university would like and have had a couple of students complain about my email response time.

I'm a little anxious, despite other staff telling me it merely a formality.

I've prepared a 5 page summary of key achievements and hope senior management are impressed enough by this to keep me on. 

Wish me luck :)",7,20
55,c4pbij,https://www.reddit.com/r/academia/comments/c4pbij/to_all_the_people_telling_me_to_not_get_a_phd/,To all the people telling me to not get a PhD,"I don't care about your opinion.

Well, I don't care about *that* opinion. Im a rising junior in political science, and I've approached many professors and graduate students at my institution, and they all say the same thing:

&gt;You won't get into graduate school. If you do, you won't get into a good one. If you do, you'll drop out before you finish. If you finish, you won't get hired. If you do, you won't make it past post docs. If you do, you won't get a tenure track position. If you do, you'll still be unhappy.

I want to address some of these individually

1)
&gt;You won't get into a (good) graduate school

For starters, that is a terrible reason to not even try. Maybe the chance is very small, maybe I have no chance, but there's no way to know unless I try. The only way I know I can prove you right is to listen to you and give up. 
Moreover, why do you give me such a small chance? We are sitting here at a top-10 institution, I have an above average gpa at a place known for its grade deflation, I currently have a research assistant position, and I've put myself in perfect position to receive a research grant from my institution to pursue my own research next summer. I have worked my ass off to put myself in a position to bring this dream into the realm of possibility. Why give up now?

2)
&gt;You won't finish

What evidence do you have to say that. Yes, something like half of candidates don't finish, but half do. I'm sitting here telling you to shove your pessimism up your ass, so what's to say I can't do that at the next level. Moreover, if I quit now, it's just as much of a failure to me. What is better: to absolutely fail now or to possibly fail in the future?

3)
&gt;You won't get hired/tenure

Maybe. Again, you absolutely may be correct. But, honestly, I don't give a shit. My goal is not to work in academia, it's to get a PhD. Id like to teach at the collegiate level of course, but I could also do something else. To me, the PhD itself has inherent value. Would I be subjecting myself to 5+ years of unparalleled stress for the purpose of a degree that has no practical application outside of academia? Yes, but I'm okay with that.

4)
&gt;You won't be happy

Nah, you're not happy. I'm sorry you went into a field you regret, but I'm my own person


So fuck you, I'm going to do what I want to do.



I'm sorry if this sounds preachy/entitled/anything of that sort, it's just really hard sometimes to push through the pessimism in academia.

Edit:formatting",16,0
56,c4vsa2,https://www.reddit.com/r/academia/comments/c4vsa2/woolworths_masters_home_improvement_division/,WOOLWORTHS MASTERS HOME IMPROVEMENT DIVISION,[removed],0,1
57,c4vzxd,https://www.reddit.com/r/academia/comments/c4vzxd/corporate_structure_and_strategy_a_case_of_walmart/,CORPORATE STRUCTURE AND STRATEGY A CASE OF WALMART,[removed],0,1
58,bviuuq,https://www.reddit.com/r/academia/comments/bviuuq/tools_to_make_visualizations_that_are_not_plots/,Tools to make Visualizations (that are not Plots),"Hi, I was wondering what everyone else uses when making the sorts of visualizations/flow charts/Setup Schematics/timelines/model graphs that are not directly data-fed. So for example what I might use to describe the time course of my psychophysics experiment or the structure of my model.

I've played with .dot graphs, inkscape, and just making them in a google slides presentation and exporting them, but they were all varying degrees of painful.

What do you use?

edit: Thanks for all the useful suggestions. I will definitely try lucidcharts for quick WYSIWYG things and take a stab at Tikz also, looks like thats the most seemless thing with LaTeX documents.",9,5
59,bvrarb,https://www.reddit.com/r/academia/comments/bvrarb/hello_how_do_i_cite_a_quote_from_a_documentary_apa/,Hello. How do I cite a quote from a documentary (APA).,"I prefer manually creating my citations, but I cannot figure out how to cite a quote from within a documentary no matter which resource I look at.

Background info: The source is the PBS documentary ""The Women's List"" by Timothy Greenfield-Sanders, and the quote I would like to use is from Madeleine Albright, who is interviewed in the documentary. My professor had us watch the video through Vimeo, and I have created a citation for the Vimeo video file, but I am aware that APA usually prefers original sources. I'm not sure I can even access the original as it's on PBS as a paid feature.

If anyone could tell me what the best way to cite this source would be and what the in text citation method for the quote I'm using should be I would be eternally grateful.",2,4
