,Id,Url,Title,Selftext,num_comments,score
60,bvm5e0,https://www.reddit.com/r/academia/comments/bvm5e0/how_come_only_uk_universities_have_masters/,How come only UK universities have masters programs in economics?,[deleted],11,0
61,bwzlsb,https://www.reddit.com/r/academia/comments/bwzlsb/advices_for_writing_your_first_publications/,Advices for writing your first publications?,"
I’m hoping to submit a small article based on some of my thesis research, and I’m realising article for publication writing is quite different from writing a university essay! 

I’m particularly flummoxed by citations! I’ve been reading on this topic for years, but the citations I have put in amass to an unimpressive 32. All assertions are backed up with citations, and all citations directly inform as to what I am talking about.  I look at these articles that put in hundreds and somehow feel like I’m doing it wrong. 

Any general suggestions? Did anyone go through a similar feeling when they first started to write artciles?",2,5
62,bx51rs,https://www.reddit.com/r/academia/comments/bx51rs/job_prospect_of_a_phd_in_molecular_dynamics_with/,Job prospect of a PhD in Molecular Dynamics with a materials science and engineering UG degree,What kind of jobs can anyone with a PhD concentrating on molecular dynamics simulation or any other computational materials science topic expect after finishing the PhD?,0,1
63,bx90h5,https://www.reddit.com/r/academia/comments/bx90h5/why_are_people_so_hungry_to_publish/,Why are people so hungry to publish?,"As I am about to start my PhD and I am getting more involved into reading papers, I have become very disappointed about the current state of academia, at least in my field.

&amp;#x200B;

A major part of the papers published in my field contain either very minor ideas, are completely utopic in their assumptions or contain unfixable mathematical errors. The cherry on the cake is that these papers make it to some very respectable journals and they are more often than not co-authored/supervised by very senior researchers.

&amp;#x200B;

Why are people so hungry to publish for the sake of publishing instead of actually being creative and on the point? And why do journals actually accept their papers?

&amp;#x200B;

Please tell me I am not alone thinking this.",13,12
64,bwy6as,https://i.redd.it/eotjkryimg231.jpg,Felt this on a spiritual level.,,8,280
65,bx6o1e,https://amp.theguardian.com/education/2019/jun/05/insecure-employment-for-postdoc-researchers-is-leading-to-bad-science,Insecure employment for postdocs leads to bad science,,0,4
66,bx5ydh,https://www.reddit.com/r/academia/comments/bx5ydh/another_postdoc_told_my_idea_as_hers/,Another postdoc told my idea as hers.,[deleted],2,5
67,bx6ocj,https://www.reddit.com/r/academia/comments/bx6ocj/i_know_i_will_be_judged_for_my_actions_i_need/,I know I will be judged for my actions. I need help on deciding what to do (students/professors),[deleted],0,0
68,c6sd6l,https://www.reddit.com/r/academia/comments/c6sd6l/what_masters_should_an_applied_math_undergrad/,What masters should an applied math undergrad complete to get a job?,"I came to applied math late. But I'll finish courses in Economics/Econometrics as well as Linear Algebra, ODEs, PDEs, Real Analysis, rudimentary Complex Analysis, Numerical Methods, Optimization, Probability Theory+stochastic processes, Abstract Algebra, Fourier Analysis, and Topology. I sat-in on programming classes but my programming sucks, unfortunately. I also don't have any physics. 

What masters degree should I go for if I want to either work in the aerospace or financial industries if I cannot get a PhD? 
What work can I get right now?",4,0
69,c6sqk9,https://i.redd.it/agl5gweh87731.jpg,We All Know The Feeling...,,0,1
70,c6yf77,https://www.youtube.com/watch?v=ga4OIf6oviM&amp;list=PLjlnuLy3KEpYmUQvFIFSFgeYQjVYO2gxi,"Basic tutorials for TeXmacs: Free wysiwyw documentation platform for scientists (imo a combination of LibreOffice, LyX, Inkscape, and Jupyter)",,0,0
71,c73t1r,https://www.reddit.com/r/academia/comments/c73t1r/academic_suspension_petition_help/,Academic Suspension Petition Help,[deleted],7,6
72,c3fatt,https://www.reddit.com/r/academia/comments/c3fatt/academic_editors_beware/,Academic Editors Beware,"I finally got approved as a scientific editor by [American Journal Experts \(AJE\)](https://www.aje.com), which promises its clients a “team of PhD experts [who] provide English language editing, academic translation and other manuscript preparation services” and claims that it is “trusted by the most respected names in scientific publishing,” including Nature, Wiley, and Elsevier. (Forget, for the moment, that there should be a hyphen between “English” and “language”…and the missing Oxford comma ... and ... ). 

I just found out how much they pay. And it’s a great capture of just how little value is given to good (or even comprehensible) writing in research today … 

According to the [Editorial Freelancers Association](https://www.the-efa.org/hiring/member-skills/), the average rate for “heavy copyediting” is $40-$50 per hour (with an average pace of 2 to 5 manuscript pages per hour and an industry-standard manuscript page of 250 words. That comes out to between about 3 and 10 cents per word. AJE’s standard rate is $31 for articles up to 3500 words in length –* one-eighth of one cent per word*. And that’s for a Ph.D.-credentialed editor revising scientific articles written by non-native-English-speaking scholars who will go on to publish their research in scientific journals. (And, to top it off, AJE has a relatively long and cumbersome vetting process for would-be editors. And it doesn’t disclose pay rates until it hires you.)

1.	This is the exploitative state of the marketized academia/research world in 2019. 
2.	I’m sure I can make more money by buying a box of crayons and selling my pictures at the end of the driveway.",4,20
73,c3a289,https://myassignmenthelp.com/blog/informative-speech-topics/,Best Informative Speech Topics,,0,1
74,c319pn,https://www.reddit.com/r/academia/comments/c319pn/switching_careers_whiplash/,Switching careers (whiplash),"Hello all- I've been really curious lately if there's anyone on here that can share their experience completely switching careers mid-career. For example, if you're a tenure track professor at a respectable institution in, physics, for example, then deciding that you want to go back to school and study Gender Studies, or Media Arts, or something completely different. Any experience you willing you share? How was that? What did you do? I'm also curious to hear if anyone's gone back to grad school after getting a PhD and a good job in something completely different and what that experience was like. Thanks for humoring me! :P",0,1
75,c336g0,https://www.reddit.com/r/academia/comments/c336g0/how_do_phd_students_know_whether_they_are_good_or/,How do PhD students know whether they are good or not?,"As a PhD student, I don't really know whether I'm a good PhD student or a bad one or an average one. I sometimes hear compliments from my supervisor, but sometimes also hear criticisms. from him. I just can't judge whether I'm good from my supervisor's reactions.

Is there anything that can tell me if I'm good? 

I plan on applying for postdoc fellowships after I finish my thesis, but I've heard they're very competitive and only the best of the best can get the fellowships. But I've no idea whether I'm good enough, nor do I know what kind of PhD students are the best of the best. I know of a few PhD graduates in my department who got postdoc fellowships, but I can't tell why they can get one - I've checked their information but still don't know what makes them stand out.",36,29
76,c2y0rs,https://i.redd.it/rlh3bqk2oh531.jpg,(Spoilers about Game of Thrones) Drogon is really depressed.,,0,14
77,c2zcyv,https://blogs.scientificamerican.com/observations/scientific-research-shouldnt-sit-behind-a-paywall/,Scientific Research Shouldn't Sit behind a Paywall,,0,12
78,c2y03a,https://i.redd.it/rlh3bqk2oh531.jpg,Daenerys is up for another challenge.,[deleted],0,1
79,c2urco,https://www.reddit.com/r/academia/comments/c2urco/literature_review_the_factors_and_development/,Literature Review: The Factors and Development,[removed],0,1
80,c303u7,https://www.reddit.com/r/academia/comments/c303u7/writing_services_summer_courses/,Writing Services (SUMMER COURSES),[removed],0,0
81,c5jr9t,https://www.reddit.com/r/academia/comments/c5jr9t/dont_want_to_ask_my_previous_professor_to_serve/,Don’t want to ask my previous professor to serve on my committee,"I’m currently choosing my dissertation committee. During my master’s, my major professor became an extremely important mentor in my life and in my work, and we are are in the process of publishing and have already published 3 papers together. Before I left for my doctoral degree, she told me that she would like to serve as an off-campus member on my dissertation committee, as she is both interested and invested in my work. However, she is extremely difficult to work with. Since I have been away from the school at which I did my masters work, I have been thinking more and more how I don’t want to ask her to be on my committee because the process of working alongside her is extremely tedious. On the opposite side, she does know my field and I also feel an obligation to allow her onto my committee because of all the opportunities she provided me during my master’s. What would you do in this situation? 

tl;dr My MS advisor wants to serve on my dissertation committee, but working with her for the past 3 years has made me want to limit working with her as much as possible. She’s an extremely meticulous editor (which is good) but she’s high maintenence.",7,3
82,c5oq79,https://www.reddit.com/r/academia/comments/c5oq79/using_a_college_professors_recommendation_letter/,Using a college professor's recommendation letter for a second master's?,"So, I did a poli sci master's degree at a research university immediately after doing my BA at a small liberal arts college. I am considering pursuing a second master's in statistics and am wondering whether it would reflect poorly on me if I use my college professors' recommendation letters. I still have those letters saved on Interfolio, and I know they are very strong because I had wonderful, very close relationships with my college professors. My graduate professors worked with me more recently (last year), and would write good letters, but they would probably not be as strong as the ones I already have. Could you all please advise? For example, if an application requires two letters of recommendation, would it be best to use:

* Two very strong, but less recent, letters 
* One strong letter and one good, but less strong, letter from my grad stats professor
* Two letters from my graduate professors 

Thank you in advance for any words of advice!",4,5
83,c5rpiy,https://www.reddit.com/r/academia/comments/c5rpiy/app_for_project_management/,App for project management,"I am currently doing a project which involves 3 people and consists in building up a backtesting platform for financial strategies.  I was looking for a softwar/app which is easy to use and help to keep track of progresses/issues and things to do.

&amp;#x200B;

There are a number of similar apps and I was wondering if one can name some of them that have been helpful in doing project management.",3,1
84,c5tl6s,https://i.redd.it/q6kcroq8vq631.jpg,This meme is significant.,,13,134
85,c5r2yj,https://www.reddit.com/r/academia/comments/c5r2yj/minority_faculty_hiring/,Minority faculty hiring,[deleted],7,3
86,c5vlrj,https://www.reddit.com/r/academia/comments/c5vlrj/professor_lying_to_dean_of_students_office/,Professor Lying to Dean of Students Office,[deleted],5,0
87,c5xmi4,https://www.reddit.com/r/academia/comments/c5xmi4/how_to_prepare_for_a_career_in_academia_as_an/,How to prepare for a career in academia as an undergrad?,[deleted],1,4
88,bz8s0f,https://www.reddit.com/r/academia/comments/bz8s0f/how_do_you_conduct_the_literature_review/,How do you conduct the literature review component of a paper when another author has already done a literature review paper regarding the same topic even at a more general level?,"I ask because I'm having a hard time trying to ""reinvent the wheel"" when someone has already done it",4,4
89,bzaxo1,https://www.reddit.com/r/academia/comments/bzaxo1/first_academic_interview/,First academic interview!,"So I got some very exciting news: I got invited to interview for my first academic job application ever! It's for an assistant professor position, and the process will involve a short demonstration lecture (30 mins) and a half hour interview.


Of course I will be asking for help from my supervisor, peers, and our careers service, but I was wondering what tips and advice this lovely subreddit would have to offer? I'm very nervous and excited, not counting on being successful on my first ever go but I want to do myself proud. I'm in cognitive narratology by the way!",9,24
90,bz8d86,https://truthout.org/articles/underpaid-adjunct-professors-sleep-in-cars-and-rely-on-public-aid/,Underpaid Adjunct Professors Sleep in Cars and Rely on Public Aid,,14,34
91,bzhtve,https://www.reddit.com/r/academia/comments/bzhtve/best_moonlighting_opportunities_prof_in_social/,"Best ""moonlighting"" opportunities? Prof in social sciences/humanities",[deleted],1,3
92,bzo8xi,https://www.reddit.com/r/academia/comments/bzo8xi/how_to_mentally_pass_the_time_when_invigilating/,How to mentally pass the time when invigilating (overseeing exams),What the title says. I m bored out of my mind and time barely crawls by. How do you handle it?,6,7
93,bztpta,https://www.reddit.com/r/academia/comments/bztpta/has_anyone_written_about_the_politics_of_nobel/,Has anyone written about the politics of Nobel Prizes?,"There has to be some social component to it. Every year can't have a single individual in each discipline that totally sets themselves apart from the rest, and even within a single discipline it must be hard to weigh two different efforts.


That said it sounds wildly interesting. I wonder if contenders have to ""court"" the Nobel body the way I've heard Oscar contenders have to


I'm specifically referring to the science disciplines. Not the Peace Prize

edit: [what do ya know](https://www.amazon.com/Politics-Excellence-Behind-Nobel-Science/dp/0716731037). Would still love to hear what the sub thinks",8,18
94,bzltl2,https://www.youtube.com/watch?v=YnQZHjCODEw,Patients lead peer review to fight conflicts of interest in publishing,,0,1
95,bzn4ew,https://youtu.be/Q-HHQqcGisQ,Ethnography,,0,0
96,bzw91x,https://www.reddit.com/r/academia/comments/bzw91x/what_are_some_qualitiesstories_of_the_best/,What are some qualities/stories of the best research students you've had?,[deleted],2,5
