,post_id,post_url,post_title
305,clhdys,https://www.reddit.com/r/AskProgramming/comments/clhdys/how_to_start_learning_java/,How to start learning Java?
306,clk18l,https://www.reddit.com/r/AskProgramming/comments/clk18l/how_to_move_files_from_many_folders_to_one_place/,How to move files from many folders to one place &amp; rename it all?
307,clk35q,https://www.reddit.com/r/AskProgramming/comments/clk35q/anybody_got_a_list_of_employers_that_dont_skimp/,Anybody got a list of employers that don't skimp out on tools for their developers?
308,clkuav,https://www.reddit.com/r/AskProgramming/comments/clkuav/i_just_finished_laying_out_a_website_with_grid/,"I just finished laying out a website with Grid for the first time, do you see anything I can improve on?"
309,cllbkm,https://www.reddit.com/r/AskProgramming/comments/cllbkm/advice_needed_creating_a_home_wifi_landing_page/,Advice Needed: Creating a home wifi landing page for family or something similar?
310,clm3n1,https://www.reddit.com/r/AskProgramming/comments/clm3n1/want_to_build_a_web_site_that_is_essentially_just/,Want to build a web site that is essentially just live streaming some content that I host locally
311,clmdlh,https://www.reddit.com/r/AskProgramming/comments/clmdlh/emoji_rendering_as_black_box/,Emoji rendering as black box
312,cln9ic,https://www.reddit.com/r/AskProgramming/comments/cln9ic/how_to_represent_these_class_relationships_in_c/,How to represent these class relationships in C++
313,clnwll,https://www.reddit.com/r/AskProgramming/comments/clnwll/running_pathing_code_that_wraps_c_on_hadoop/,Running pathing code that wraps c++ on hadoop
314,cljbh4,https://www.reddit.com/r/AskProgramming/comments/cljbh4/when_do_you_determine_the_version_of_a_release/,"When do you determine the version of a release? Before you start development of whatever you intend to add/change/fix or after you've finished and about to release? Is it the same for every type of release (i.e. major, minor, patch)"
315,clkt4e,https://www.reddit.com/r/AskProgramming/comments/clkt4e/whats_a_good_book_for_getting_to_grips_with/,What’s a good book for getting to grips with gritty platform specific aspects of C++?
316,clmqht,https://www.reddit.com/r/AskProgramming/comments/clmqht/looking_for_a_language_in_the_middle_between_c/,Looking for a language in the middle between C and Haskell
317,clokr1,https://www.reddit.com/r/AskProgramming/comments/clokr1/firebase_how_do_i_go_about_communicating_with_my/,Firebase: how do I go about communicating with my database ?
318,cp4zbo,https://www.reddit.com/r/AskProgramming/comments/cp4zbo/google_smart_home_device/,Google smart home device
319,cp55el,https://www.reddit.com/r/AskProgramming/comments/cp55el/retrieve_returns_a_single_account_with_the/,"retrieve() - returns a single Account with the specified accountID from the accounts Map. If none is found, return null."
320,cp6clt,https://www.reddit.com/r/AskProgramming/comments/cp6clt/how_would_you_style_this_i_used_float_but_it/,How would you style this? I used float but it doesn't look good and can't quite figure out how to do it using Grid or Flex
321,cp6o85,https://www.reddit.com/r/AskProgramming/comments/cp6o85/start_with_web_development_or_app_development/,Start with web development or app development?
322,cp76jw,https://www.reddit.com/r/AskProgramming/comments/cp76jw/how_to_solve_doesnt_match_the_certificate_for_the/,"How to solve ""Doesn't match the certificate for the app"" on Google Play?"
323,cp7ds1,https://www.reddit.com/r/AskProgramming/comments/cp7ds1/way_to_create_apple_calendar_events_through_an_api/,Way to create apple calendar events through an API?
324,cp7ei6,https://www.reddit.com/r/AskProgramming/comments/cp7ei6/looking_for_ideas_on_integrating_a_push_to_talk/,Looking for ideas on integrating a Push To Talk feature in a C# mobile app.
325,cp7h1g,https://www.reddit.com/r/AskProgramming/comments/cp7h1g/what_do_ml_engineers_actually_do/,What do ML Engineers actually do?
326,cp8g5z,https://www.reddit.com/r/AskProgramming/comments/cp8g5z/what_to_learn_to_become_a_software/,What to learn to become a software engineer/developer?
327,cp8jj7,https://www.reddit.com/r/AskProgramming/comments/cp8jj7/calling_subnested_functions_in_react/,Calling sub/nested functions in React
328,cp9ioz,https://www.reddit.com/r/AskProgramming/comments/cp9ioz/can_i_add_a_python_decompiler_to_visual_studio/,Can I add a python decompiler to Visual Studio?
329,cp9x0k,https://www.reddit.com/r/AskProgramming/comments/cp9x0k/serious_how_to_deal_with_small_windows_of/,[SERIOUS] How to deal with small windows of downtime while developing/debugging?
330,cpbwa3,https://www.reddit.com/r/AskProgramming/comments/cpbwa3/design_about_modelling_behaviour_more_parameters/,"[Design] About modelling behaviour. More parameters on function, or new function?"
331,cpby8d,https://www.reddit.com/r/AskProgramming/comments/cpby8d/editing_xml_saved_as_string_in_table_column_using/,Editing XML saved as string in table column using SQL
332,cpcf0e,https://www.reddit.com/r/AskProgramming/comments/cpcf0e/how_to_return_multiple_sql_queries_in_java/,How to return multiple SQL queries in Java?
333,cpctjc,https://www.reddit.com/r/AskProgramming/comments/cpctjc/best_way_to_locally_store_secrets/,Best way to locally store secrets?
334,cpe4mo,https://www.reddit.com/r/AskProgramming/comments/cpe4mo/im_starting_a_masc_in_computational_engineering/,I'm starting a MASc in computational engineering. I'll be running simulations with many different versions of code and variables. What's the best way to manage this?
335,cpeb9b,https://www.reddit.com/r/AskProgramming/comments/cpeb9b/personal_project_advice/,Personal Project Advice
336,cpedph,https://www.reddit.com/r/AskProgramming/comments/cpedph/project_with_a_large_spreadsheet_pinpointing_rows/,"Project with a large spreadsheet - pinpointing rows with the most ""important"" words rather than frequent"
337,cpfqpb,https://www.reddit.com/r/AskProgramming/comments/cpfqpb/programming_application_to_change_current_image/,Programming application to change current image in real time?
338,cpgwuy,https://www.reddit.com/r/AskProgramming/comments/cpgwuy/whats_the_best_way_to_generate_a_schema_from_a/,What's the best way to generate a schema from a certain set of parameters?
339,cphmng,https://www.reddit.com/r/AskProgramming/comments/cphmng/whats_the_best_to_automate_video_view_counts_from/,What's the best to automate video view counts from LinkedIn &amp; Twitter to a Google Sheets document?
340,cphtld,https://www.reddit.com/r/AskProgramming/comments/cphtld/suggestions_for_gui_practice_for_hobby_project/,Suggestions for GUI practice for hobby project
341,cpi08f,https://www.reddit.com/r/AskProgramming/comments/cpi08f/how_should_i_start_with_mvvm_retrofit/,How should I start with MVVM + Retrofit?
342,cpi0ov,https://www.reddit.com/r/AskProgramming/comments/cpi0ov/c_array_struct/,C# array struct
343,cpiqf9,https://www.reddit.com/r/AskProgramming/comments/cpiqf9/using_send_api_to_send_customized_messages_to_fb/,Using Send API to send customized messages to FB messenger via Amazon Web Services
344,cpjrmf,https://www.reddit.com/r/AskProgramming/comments/cpjrmf/trying_to_find_a_simple_algorithm_for_rewriting/,Trying to find a simple algorithm for rewriting into a run-length-encoded binary sequence
345,cpk26v,https://www.reddit.com/r/AskProgramming/comments/cpk26v/how_different_is_your_work_setup_vs_your_home/,How different is your work setup vs your home setup for programming?
346,cpkdkx,https://www.reddit.com/r/AskProgramming/comments/cpkdkx/how_to_tell_how_popular_a_given_numpy_function_is/,How to tell how popular a given NumPy function is
347,cp4uuj,https://www.reddit.com/r/AskProgramming/comments/cp4uuj/reversing_information_in_database_php_sqli/,Reversing Information in database PHP SQLi
348,cp7qr9,https://www.reddit.com/r/AskProgramming/comments/cp7qr9/what_to_study_to_get_into_competitive_programming/,What to study to get into competitive programming?
349,cum4r2,https://www.reddit.com/r/AskProgramming/comments/cum4r2/unity_mac_build_to_run_an_exe/,Unity mac build to run an exe
350,cunqzi,https://www.reddit.com/r/AskProgramming/comments/cunqzi/tic_tac_toe/,Tic Tac Toe
351,cuou96,https://www.reddit.com/r/AskProgramming/comments/cuou96/python_beginner_level/,Python beginner level
352,cup4t9,https://www.reddit.com/r/AskProgramming/comments/cup4t9/is_normalizedcss_still_used/,Is Normalized.css still used?
353,cup764,https://www.reddit.com/r/AskProgramming/comments/cup764/cicd_is_it_okay_to_build_on_every_push/,[CI/CD] Is it okay to build on every push?
354,cuq7ig,https://www.reddit.com/r/AskProgramming/comments/cuq7ig/building_a_web_search_engine/,Building a web search engine
355,cuqh6m,https://www.reddit.com/r/AskProgramming/comments/cuqh6m/at_which_point_can_you_list_c_on_a_resume_when/,At which point can you list C++ on a resume when self teaching?
356,cur2dx,https://www.reddit.com/r/AskProgramming/comments/cur2dx/answer_pls/,ANSWER PLS
357,cur7nw,https://www.reddit.com/r/AskProgramming/comments/cur7nw/effective_research_when_programming/,Effective Research when Programming
358,cus9db,https://www.reddit.com/r/AskProgramming/comments/cus9db/fft/,FFT
359,cusdhu,https://www.reddit.com/r/AskProgramming/comments/cusdhu/what_exactly_is_an_hta_html_application_and_why/,What exactly is an HTA (HTML Application)? And why aren't they popular?
360,cuttzd,https://www.reddit.com/r/AskProgramming/comments/cuttzd/android_google_sign_in/,Android Google SIgn In
361,cuuvxx,https://www.reddit.com/r/AskProgramming/comments/cuuvxx/integrating_own_mfa_into_active_directory_for/,Integrating own MFA into Active Directory for Machine Logon
362,cuvdvs,https://www.reddit.com/r/AskProgramming/comments/cuvdvs/how_could_i_detect_black_circles_in_a_white_image/,How could I detect black circles in a white image?
363,cuvuke,https://www.reddit.com/r/AskProgramming/comments/cuvuke/auto_hotkey_question/,Auto Hotkey question
364,cuwr7f,https://www.reddit.com/r/AskProgramming/comments/cuwr7f/can_someone_who_is_good_or_even_mediocre_at/,Can someone who is good (or even mediocre) at programming explain why a game can’t just constantly save?
365,cuzqtu,https://www.reddit.com/r/AskProgramming/comments/cuzqtu/rust_question_about_option_usage_in_structs/,Rust | Question about Option usage in structs.
366,cv13kv,https://www.reddit.com/r/AskProgramming/comments/cv13kv/what_do_you_write_your_documentationnotes_in_what/,What do you write your documentation/notes in? What is your workflow to avoid messy documentation?
367,cumacc,https://www.reddit.com/r/AskProgramming/comments/cumacc/is_there_any_blockchain_whose_purpose_is_only_to/,Is there any blockchain whose purpose is ONLY to generate random bits that the most people and computers agree are actually random?
368,cuxe8x,https://www.reddit.com/r/AskProgramming/comments/cuxe8x/what_is_the_file_extension_in_pythonista/,What is the file extension in Pythonista
369,cuy5pt,https://www.reddit.com/r/AskProgramming/comments/cuy5pt/is_there_a_standard_credit_card_protocol_paypal/,Is there a standard credit card protocol? PayPal did some blackmagic fuckery to deposit money instantly into my bank using only my debit card. My bank transaction history shows it as a credit adjustment. I'm super intrigued how this works.
370,cuzpni,https://www.reddit.com/r/learnpython/comments/cuzbpt/how_to_add_a_timestamp_to_data_script/,How to add a timestamp to JSON data script - Python
371,cqyaho,https://www.reddit.com/r/AskProgramming/comments/cqyaho/learning_java_what_is_the_best_way_to_find_a/,"Learning Java, what is the best way to find a method for your need?"
372,cr0o2r,https://www.reddit.com/r/AskProgramming/comments/cr0o2r/really_beginner_issue/,Really Beginner Issue
373,cr1ai8,https://www.reddit.com/r/AskProgramming/comments/cr1ai8/running_py_script_via_terminal_throws_error_when/,Running .py script via Terminal throws error when referencing .txt file in same folder
374,cr29vf,https://www.reddit.com/r/AskProgramming/comments/cr29vf/how_to_make_a_browser_like_application_to_save/,"How to make a browser like application to save page as mhtml, screenshot e.t.c"
375,cr2hh3,https://www.reddit.com/r/AskProgramming/comments/cr2hh3/is_there_any_neural_network_that_can_readjust_its/,Is there any neural network that can readjust its skeleton itself.
376,cr2ho6,https://www.reddit.com/r/AskProgramming/comments/cr2ho6/easiest_way_to_automatically_put_new_version_of_a/,"(Easiest way to) Automatically put new version of a file on local server, archive old file and update html-file. Php? Javascript?"
377,cr2jmy,https://www.reddit.com/r/AskProgramming/comments/cr2jmy/there_was_a_guy_who_deleted_some_database_tables/,There was a guy who deleted some database tables at work. What happened to him / people like him in general?
378,cr57zp,https://www.reddit.com/r/AskProgramming/comments/cr57zp/verifying_connectivity_of_a_graph_in_on2/,Verifying connectivity of a graph in O(n^2)
379,cr6idb,https://www.reddit.com/r/AskProgramming/comments/cr6idb/curious_about_why_i_have_to_reopen_software/,Curious about why I have to reopen software multiple times for it to work.
380,cr6tot,https://www.reddit.com/r/AskProgramming/comments/cr6tot/post_to_whatsapp_anonymously/,Post to WhatsApp anonymously
381,cr8yt3,https://www.reddit.com/r/AskProgramming/comments/cr8yt3/best_books_to_teach_about_convolutional_neural/,"Best books to teach about convolutional neural networking, cyber security and/or networking"
382,cr9ixu,https://www.reddit.com/r/AskProgramming/comments/cr9ixu/need_help_with_the_pre_release/,Need help with the pre release
383,cr9za2,https://www.reddit.com/r/AskProgramming/comments/cr9za2/port_forwarding_not_working_for_nodejs_application/,Port forwarding not working for Nodejs application
384,cqyj4v,https://www.reddit.com/r/AskProgramming/comments/cqyj4v/has_anyone_built_their_own_recommender_system_if/,"Has anyone built their own recommender system? If so, how hard was it and what were the methods to create it?"
385,cr8q39,https://www.reddit.com/r/AskProgramming/comments/cr8q39/free_programming_books/,Free Programming Books
386,cr5lfl,https://www.reddit.com/r/AskProgramming/comments/cr5lfl/c_json_serialization_of_fields/,[C#] Json Serialization of fields
387,cr8tn6,https://www.reddit.com/r/AskProgramming/comments/cr8tn6/what_to_do_i_am_having_a_panic_attack_over_the/,What to do? I am having a panic attack over the options on how to do this project
388,crc4l2,https://www.reddit.com/r/AskProgramming/comments/crc4l2/how_does_a_interrupt_work/,How does a Interrupt work?
389,cvgm7d,https://www.reddit.com/r/AskProgramming/comments/cvgm7d/sql_query_returning_different_of_rows_on_multiple/,SQL - Query returning different # of rows on multiple left join
390,cvgyqa,https://www.reddit.com/r/AskProgramming/comments/cvgyqa/c_writing_an_int_to_binary_file_and_then_reading/,[C] Writing an int to binary file and then reading it gives different number
391,cvhbqq,https://www.reddit.com/r/AskProgramming/comments/cvhbqq/how_to_start_my_career_hunt_with_a_bang/,How to start my career hunt with a bang?
392,cvhp7m,https://www.reddit.com/r/AskProgramming/comments/cvhp7m/question_to_anyone_who_frequents_coding_contests/,Question to anyone who frequents coding contests.
393,cvi2he,https://www.reddit.com/r/AskProgramming/comments/cvi2he/i_dont_know_if_i_have_what_it_takes_to_learn/,I don't know if I have what it takes to learn programming.
394,cvi3u6,https://www.reddit.com/r/AskProgramming/comments/cvi3u6/3d_modeling_how_can_i_implement_3d_objects_into/,[3D Modeling] How can I implement 3D objects into an application or website?
395,cvj43t,https://www.reddit.com/r/AskProgramming/comments/cvj43t/how_can_you_remove_the_noise_generated_from/,How can you remove the noise generated from transforming to .png?
396,cvjat6,https://www.reddit.com/r/AskProgramming/comments/cvjat6/which_language_should_i_use_for_this/,Which language should I use for this?
397,cvkoko,https://www.reddit.com/r/AskProgramming/comments/cvkoko/what_tools_do_you_keep_setting_up_before_starting/,What tools do you keep setting up before starting new projects?
398,cvlni8,https://www.reddit.com/r/AskProgramming/comments/cvlni8/in_the_context_of_envlocal_should_i_commit_my_env/,"In the context of `.env.local`, should I commit my `.env`?"
399,cvlp79,https://www.reddit.com/r/AskProgramming/comments/cvlp79/at_which_level_is_ideal_to_check_user_input/,At which level is ideal to check user input before sending it to the database?
400,cvmgt1,https://www.reddit.com/r/AskProgramming/comments/cvmgt1/clientclient_file_transfer_in_golang/,client-client file transfer in golang
401,cvn4qc,https://www.reddit.com/r/AskProgramming/comments/cvn4qc/looking_for_a_way_to_combine_ids_for_traceability/,Looking for a way to combine IDs for traceability
402,cvow6x,https://www.reddit.com/r/AskProgramming/comments/cvow6x/altering_variables_outside_function_call/,"Altering variables outside function call, AngularJS/HTML"
403,cvpiis,https://www.reddit.com/r/AskProgramming/comments/cvpiis/alternatives_to_rest_interfaces/,Alternatives to REST Interfaces
404,cvrhj2,https://www.reddit.com/r/AskProgramming/comments/cvrhj2/when_to_create_a_new_branch_in_git/,When to create a new branch in git.
405,cvru9c,https://www.reddit.com/r/AskProgramming/comments/cvru9c/front_controller_pattern_c/,Front controller pattern c#
406,cvrwyi,https://www.reddit.com/r/AskProgramming/comments/cvrwyi/i_want_to_be_able_to_make_a_custom_flag_northern/,I want to be able to make a custom flag (Northern Ireland) emoji
407,cvs34z,https://www.reddit.com/r/AskProgramming/comments/cvs34z/how_does_allocating_memory_for_your_program_work/,How does allocating memory for your program work?
408,cvssft,https://www.reddit.com/r/AskProgramming/comments/cvssft/how_do_i_run_a_sql_script_on_macos/,How do I run a SQL script on MacOS?
409,cvsw89,https://www.reddit.com/r/AskProgramming/comments/cvsw89/senior_programmers_of_reddit_what_do_you_think/,"Senior programmers of Reddit, what do you think when a junior programmer makes a mistake or can't solve the problem?"
410,cvunum,https://www.reddit.com/r/AskProgramming/comments/cvunum/pointer_overflow_when_peeking_at_element_of_a_fifo/,Pointer overflow when peeking at element of a fifo ?
411,cvv0l9,https://www.reddit.com/r/AskProgramming/comments/cvv0l9/64_bit_numbers_in_32_bit_executable/,64 bit numbers in 32 bit executable
412,cvvjkk,https://www.reddit.com/r/AskProgramming/comments/cvvjkk/can_any_php_gurus_help_me_run_this_magento_class/,"Can any PHP gurus help me run this Magento class, please?"
413,cvvv1s,https://www.reddit.com/r/AskProgramming/comments/cvvv1s/starting_a_coding_club_at_my_high_school/,Starting a Coding Club at my High School
414,cvove4,https://www.reddit.com/r/AskProgramming/comments/cvove4/what_is_the_relationship_between_nodejs_and_npm/,What is the relationship between nodeJS and npm?
415,cvj8xs,https://www.reddit.com/r/AskProgramming/comments/cvj8xs/using_a_select_input_and_multiple_data_attributes/,Using a select input and multiple data attributes to filter out elements in JQuery?
416,cvlq8m,https://www.reddit.com/r/AskProgramming/comments/cvlq8m/how_to_publishdeploy_react_app/,How to publish/deploy React app?
417,cvu8ab,https://www.reddit.com/r/AskProgramming/comments/cvu8ab/password_generator/,Password Generator
418,cndydj,https://www.reddit.com/r/AskProgramming/comments/cndydj/need_advice_on_customizing_online_store/,Need Advice on Customizing Online Store
419,cne21k,https://www.reddit.com/r/AskProgramming/comments/cne21k/how_do_i_use_the_youtube_closed_caption_api/,How do I use the YouTube Closed Caption API?
420,cneuwl,https://www.reddit.com/r/AskProgramming/comments/cneuwl/help_me_not_use_unity_webgl/,Help me not use Unity WebGL
421,cnh3t2,https://www.reddit.com/r/AskProgramming/comments/cnh3t2/is_this_that_bad_of_an_idea/,Is this that bad of an idea?
422,cnh668,https://www.reddit.com/r/AskProgramming/comments/cnh668/where_do_stackoverflow_wizards_come_from/,Where do StackOverflow wizards come from?
423,cnhiv5,https://www.reddit.com/r/AskProgramming/comments/cnhiv5/lwjgl/,Lwjgl
424,cnjif9,https://www.reddit.com/r/AskProgramming/comments/cnjif9/self_hosted_apps_and_containers/,Self Hosted apps and Containers
425,cnjvme,https://www.reddit.com/r/AskProgramming/comments/cnjvme/are_there_good_programming_habits_expanded/,Are there good programming habits? (expanded)
426,cnk3f1,https://www.reddit.com/r/AskProgramming/comments/cnk3f1/ive_built_the_first_part_of_a_bash_script_but_not/,I've built the first part of a bash script but not sure how to introduce a database to petform another function.
427,cnnckp,https://www.reddit.com/r/AskProgramming/comments/cnnckp/copy_and_rename_batched_files_in_linux/,copy and rename batched files in linux
428,cnnmb2,https://www.reddit.com/r/AskProgramming/comments/cnnmb2/is_there_a_library_for_executing_html_in_python/,Is there a library for executing html in python
429,cnoear,https://www.reddit.com/r/AskProgramming/comments/cnoear/should_the_model_in_an_mvc_carry_most_of_the/,Should the Model in an MVC carry most of the functionality or the Controller.
430,cnoyse,https://www.reddit.com/r/AskProgramming/comments/cnoyse/should_linting_occur_in_a_ci_pipeline/,Should linting occur in a CI pipeline?
431,cnr8da,https://www.reddit.com/r/AskProgramming/comments/cnr8da/maven_project_refuses_to_find_jdbc_driver/,Maven project refuses to find JDBC driver
432,cnh1xe,https://www.reddit.com/r/AskProgramming/comments/cnh1xe/what_are_some_good_resources_from_where_i_can/,What are some good resources from where I can start studying reinforcement learning from scratch?
433,cnsrir,https://www.reddit.com/r/AskProgramming/comments/cnsrir/why_does_python_have_a_reputation_for_begin_good/,Why does python have a reputation for begin good with data?
434,cnhfh2,https://www.reddit.com/r/AskProgramming/comments/cnhfh2/windows_command_question/,Windows command question
435,cnmo2f,https://www.reddit.com/r/AskProgramming/comments/cnmo2f/willing_to_pay_for_help_regarding_using_imacro_or/,Willing to pay for help regarding using iMacro or other program to automate a process for me
436,cnrj0f,https://www.reddit.com/r/AskProgramming/comments/cnrj0f/looking_for_a_report_writer_with_an_enduser/,Looking for a report writer with an end-user design component that works in Xamarin
437,cwdgv6,https://www.reddit.com/r/AskProgramming/comments/cwdgv6/raptor_oop_overloaded_constructors/,Raptor OOP overloaded Constructors
438,cwfioa,https://www.reddit.com/r/AskProgramming/comments/cwfioa/i_like_coding_small_games_but_i_dislike_todays/,I like coding small games but I dislike today's engines. What's a way forward?
439,cwg4hr,https://www.reddit.com/r/AskProgramming/comments/cwg4hr/need_help_remembering_a_video/,Need help remembering a video
440,cwibvk,https://www.reddit.com/r/AskProgramming/comments/cwibvk/what_is_the_ideal_architecture_for_showing/,What is the ideal architecture for showing messages from backend API return on frontend?
441,cwijqm,https://www.reddit.com/r/AskProgramming/comments/cwijqm/how_do_i_handle_real_money_transactions/,How do I handle real money transactions?
442,cwjszu,https://www.reddit.com/r/AskProgramming/comments/cwjszu/programming_needs_for_browser_game/,Programming needs for browser game?
443,cwk8xu,https://www.reddit.com/r/AskProgramming/comments/cwk8xu/what_is_the_benefit_of_compiling_to_bytecode/,What is the benefit of compiling to bytecode before interpreting in interpreted languages like Java?
444,cwlhco,https://www.reddit.com/r/AskProgramming/comments/cwlhco/java_how_to_create_subclass_that_will_always/,(Java) how to create subclass that will always match superclass constructor?
445,cwmj8s,https://www.reddit.com/r/AskProgramming/comments/cwmj8s/hey_guys_newly_formed_programmer2_days_old_who/,"Hey Guys, Newly formed programmer(2 Days old) who just needs some guidance ?"
446,cwmts0,https://www.reddit.com/r/AskProgramming/comments/cwmts0/is_there_a_way_to_statically_type_in_python/,Is there a way to statically type in Python?
447,cwncej,https://www.reddit.com/r/AskProgramming/comments/cwncej/help_me_find_cli_library_for_faster_tests_by/,Help me find: CLI library for faster tests by increasing system clock
448,cwnuj9,https://www.reddit.com/r/AskProgramming/comments/cwnuj9/why_would_someone_prefer_other_way_of_doing_this/,Why would someone prefer other way of doing this arithmetic?
449,cwo97s,https://www.reddit.com/r/AskProgramming/comments/cwo97s/what_is_your_dating_life_like/,What Is Your Dating Life Like???
450,cwoxkb,https://www.reddit.com/r/AskProgramming/comments/cwoxkb/robotics_i_have_kinematics_and_i_want_dynamics/,"Robotics: I have kinematics and I want dynamics, but I don't grok the math. Please help?"
451,cwp3kp,https://www.reddit.com/r/AskProgramming/comments/cwp3kp/is_there_such_a_thing_as_a_union_of_concerned/,Is there such a thing as a Union of Concerned Programmers?
452,cwp649,https://www.reddit.com/r/AskProgramming/comments/cwp649/i_want_to_learn_to_code_and_dont_really_want_to/,I want to learn to code and don't really want to spend a lot of moeny for a pc. Is that good enough?
453,cwpex2,https://www.reddit.com/r/AskProgramming/comments/cwpex2/what_do_you_think_of_project_managers/,What do you think of project managers?
454,cwpjnz,https://www.reddit.com/r/AskProgramming/comments/cwpjnz/phone_expression_assistance/,Phone # Expression Assistance
455,cwqbnl,https://www.reddit.com/r/AskProgramming/comments/cwqbnl/simulate_multiple_click_on_a_mouse_press_python/,Simulate multiple click on a mouse press python
456,cwqs9i,https://www.reddit.com/r/AskProgramming/comments/cwqs9i/how_do_you_deal_with_depression/,How do you deal with depression?
457,cwqyyp,https://www.reddit.com/r/AskProgramming/comments/cwqyyp/whats_the_best_option_for_inapp_payment/,What's the best option for In-App payment implementation?
