,post_id,post_url,post_title
458,cwr8t9,https://www.reddit.com/r/AskProgramming/comments/cwr8t9/js_why_does_the_first_nonarrow_function_work_but/,"[JS] Why does the first non-arrow function work, but the second arrow-function which seems identical fail?"
459,cwk3j2,https://www.reddit.com/r/AskProgramming/comments/cwk3j2/in_home_wifi_is_the_router_simultaneously_a_dhcp/,"In home WiFi, is the router simultaneously a DHCP server, a DNS nameserver, and a NAT translator?"
460,cwezgn,https://www.reddit.com/r/AskProgramming/comments/cwezgn/help_with_awk_capitalization_syntax/,Help with AWK capitalization syntax
461,cwnwa2,https://www.reddit.com/r/AskProgramming/comments/cwnwa2/snake_case_vs_camelcase_how_much_does_it_really/,snake_case vs. camelCase - How much does it really matter?
462,cwsfb5,https://www.reddit.com/r/AskProgramming/comments/cwsfb5/coding_gui_help_appreciated/,Coding GUI help appreciated
463,csqc8o,https://www.reddit.com/r/AskProgramming/comments/csqc8o/quick_help_with_stupid_twig_crap/,Quick help with stupid twig crap
464,csrhz7,https://www.reddit.com/r/AskProgramming/comments/csrhz7/creating_a_polygon_surrounding_a_collection_of/,Creating a polygon surrounding a collection of points.
465,csri6c,https://www.reddit.com/r/AskProgramming/comments/csri6c/need_help_to_find_a_way_to_use_a_code_in_git/,Need help to find a way to use a code in Git.
466,cssn1p,https://www.reddit.com/r/AskProgramming/comments/cssn1p/whats_the_efficient_solution_for_this_problem/,What's the efficient solution for this problem?
467,cssufx,https://www.reddit.com/r/AskProgramming/comments/cssufx/how_do_you_create_the_equivalent_of_tag_types_in/,How do you create the equivalent of tag types in JSON?
468,cstb94,https://www.reddit.com/r/AskProgramming/comments/cstb94/best_blockchain_programming_languages_2019/,Best Blockchain Programming Languages 2019 | Updated List
469,csvges,https://www.reddit.com/r/AskProgramming/comments/csvges/looking_for_a_team_to_buildhire/,Looking for a team to build/hire
470,cswy6w,https://www.reddit.com/r/AskProgramming/comments/cswy6w/is_it_possible_to_bootstrap_an_os_from_lambda/,Is it possible to bootstrap an OS from lambda calculus?
471,csxcd5,https://www.reddit.com/r/AskProgramming/comments/csxcd5/want_to_create_a_blog_type_website_on_my_own/,Want to create a blog type website on my own.
472,csyhc3,https://www.reddit.com/r/AskProgramming/comments/csyhc3/has_anyone_tried_an_everything_raii_programming/,Has anyone tried an ‘everything RAII’ programming paradigm?
473,csz743,https://www.reddit.com/r/AskProgramming/comments/csz743/php_or_is_something_better/,PHP or is something better?
474,cszbwj,https://www.reddit.com/r/AskProgramming/comments/cszbwj/are_there_any_book_websites_that_allow_scraping/,Are there any book websites that allow scraping of the text? [PYTHON]
475,cszqs8,https://www.reddit.com/r/AskProgramming/comments/cszqs8/count_down_timer_should_i_keep_track_of/,"Count down timer: Should I keep track of everything on server and send 'timeleft' updates to clients, or send message saying 'timerstarted' and let clients handle the countdown."
476,ct0gnx,https://www.reddit.com/r/AskProgramming/comments/ct0gnx/what_are_the_best_and_worst_scm_and_cicd_tools/,What are the best and worst SCM and CI/CD tools you've used?
477,ct17bh,https://www.reddit.com/r/AskProgramming/comments/ct17bh/rethinking_blockchain_should_it_have_been_written/,Rethinking Blockchain: Should it Have Been Written In Erlang From The Start?
478,ct1cw0,https://www.reddit.com/r/AskProgramming/comments/ct1cw0/c_calling_generic_method_without_t_parameter/,C# Calling Generic Method Without T Parameter
479,ct1nfl,https://www.reddit.com/r/AskProgramming/comments/ct1nfl/hiding_filenames_from_users/,hiding filenames from users
480,ct3edy,https://www.reddit.com/r/AskProgramming/comments/ct3edy/calling_a_smart_contract_function_using_python/,Calling a Smart Contract function using Python and web3
481,ct43lk,https://www.reddit.com/r/AskProgramming/comments/ct43lk/reward_20_on_steam_i_am_interviewing_a_new/,[REWARD $20 on Steam] I am interviewing a new embedded developer tomorrow. It is my first time interviewing someone. Do you know something better than FizzBuzz?
482,ct4a1i,https://www.reddit.com/r/AskProgramming/comments/ct4a1i/migrate_existing_database_to_new_aspnet_web/,Migrate existing database to new Asp.Net Web Application
483,ct4n8d,https://www.reddit.com/r/AskProgramming/comments/ct4n8d/visual_basic/,Visual Basic
484,ct4x7m,https://www.reddit.com/r/AskProgramming/comments/ct4x7m/numba_numpy_support_in_python/,Numba numpy support in Python
485,ct58um,https://www.reddit.com/r/AskProgramming/comments/ct58um/api_wont_accept_my_request/,api won't accept my request
486,ct5gmf,https://www.reddit.com/r/AskProgramming/comments/ct5gmf/hypothetically_if_i_were_to_make_a_custom/,"Hypothetically, if i were to make a custom operating system, what would be some good advice for things to avoid, and things to try or implement?"
487,ct65xb,https://www.reddit.com/r/AskProgramming/comments/ct65xb/what_are_your_favorite_unique_apis/,What are Your Favorite Unique APIs?
488,ct6csk,https://www.reddit.com/r/AskProgramming/comments/ct6csk/i_need_a_crash_course_in_c/,I need a crash course in C
489,ct6uvq,https://www.reddit.com/r/AskProgramming/comments/ct6uvq/any_idea_what_im_looking_at/,Any idea what I'm looking at?
490,ct8lja,https://www.reddit.com/r/AskProgramming/comments/ct8lja/why_can_google_tell_what_word_im_trying_to_spell/,Why can Google tell what word I’m trying to spell but Apple autocorrect can’t?
491,ct3ggh,https://www.reddit.com/r/AskProgramming/comments/ct3ggh/i_made_a_pdf_form_with_fillable_fields_i_asked_my/,"I made a pdf form with fillable fields. I asked my developer if he could make the form download from our website versus having it display on the browser because the user can’t save the form if they’re not finished with it. He said no, that some browsers may not display the fields. Is that true?"
492,ct6n89,https://www.reddit.com/r/AskProgramming/comments/ct6n89/what_are_the_different_stages_of_careers_what/,"What are the different stages of careers, what qualifications do you need for them, and what are their pays?"
493,cstv3h,https://www.reddit.com/r/AskProgramming/comments/cstv3h/should_i_list_the_reddit_karma_i_have_in/,Should I list the Reddit karma I have in programming subreddits on my resume?
494,csyd5o,https://www.reddit.com/r/AskProgramming/comments/csyd5o/different_links_for_different_device/,different links for different device
495,ct0222,https://www.reddit.com/r/AskProgramming/comments/ct0222/are_all_ides_a_nightmare/,Are all IDEs a nightmare?
496,ct7d64,https://www.reddit.com/r/AskProgramming/comments/ct7d64/is_there_a_way_i_can_get_java_to_work_on_chrome/,Is there a way I can get java to work on chrome or safari?
497,ckhb0p,https://www.reddit.com/r/AskProgramming/comments/ckhb0p/i_really_need_a_path_to_guide_me/,I really need a path to guide me
498,ckjfq5,https://www.reddit.com/r/AskProgramming/comments/ckjfq5/license_open_for_personal_use_closed_for_profit/,"[License] Open for Personal Use, Closed for Profit"
499,cklcxb,https://www.reddit.com/r/AskProgramming/comments/cklcxb/uwp_automatically_saving_text_to_a_file/,UWP - Automatically saving text to a file
500,cklk0q,https://www.reddit.com/r/AskProgramming/comments/cklk0q/if_receive_email_manually_send_a_whatsapp_via_gui/,"If receive email, manually send a WhatsApp via GUI"
501,ckm0my,https://www.reddit.com/r/AskProgramming/comments/ckm0my/should_i_use_a_message_broker_for_get_requests/,Should I use a message broker for GET requests between internal services?
502,ckn29f,https://www.reddit.com/r/AskProgramming/comments/ckn29f/how_do_you_keep_share_knowledge_behind_your/,How do you keep &amp; share knowledge behind your codebase in your team?
503,cknmak,https://www.reddit.com/r/AskProgramming/comments/cknmak/dynamic_programming_need_help_to_implement/,[Dynamic Programming] Need help to implement Memoization
504,cknmfw,https://www.reddit.com/r/AskProgramming/comments/cknmfw/as_a_graduating_cs_student_i_have_no_idea_how_to/,As a graduating CS student I have no idea how to do real programming.
505,ckodkm,https://www.reddit.com/r/AskProgramming/comments/ckodkm/vbnet_windows_applications_to_c_web_apps/,VB.Net Windows Applications to C# Web Apps transition
506,ckora3,https://www.reddit.com/r/AskProgramming/comments/ckora3/cleverbot_like_chatbot_api_free_of_use/,CleverBot like chatbot API Free of use?
507,ckq5in,https://www.reddit.com/r/AskProgramming/comments/ckq5in/first_programming_language_to_learn_for_someone/,First programming language to learn for someone with a Linux background?
508,ckq5tc,https://www.reddit.com/r/AskProgramming/comments/ckq5tc/securing_a_junior_developer_role/,Securing a junior developer role
509,ckt7fo,https://www.reddit.com/r/AskProgramming/comments/ckt7fo/aws_google_services_or_do_it_all_by_yourself_from/,"A.W.S., Google Services, or do it all by yourself from home?"
510,ckv0vk,https://www.reddit.com/r/AskProgramming/comments/ckv0vk/why_are_terminal_emulators_so_incredibly_slow/,Why are terminal emulators so incredibly slow?
511,ckv6fv,https://www.reddit.com/r/AskProgramming/comments/ckv6fv/any_suggestions_for_powerful_selfhosted_software/,Any suggestions for powerful self-hosted software with a nice web frontend for browsing and sharing my files and metadata?
512,ckvbbi,https://www.reddit.com/r/AskProgramming/comments/ckvbbi/does_anyone_else_feel_that_they_think_differently/,Does anyone else feel that they think differently in general after having a fair amount of programming experience?
513,ckvtmx,https://www.reddit.com/r/AskProgramming/comments/ckvtmx/languages_that_focus_as_little_as_possible_on_the/,Languages that focus as little as possible on the use of exceptions
514,ckw4kk,https://www.reddit.com/r/AskProgramming/comments/ckw4kk/what_is_worth_putting_into_a_portfolio/,What is worth putting into a portfolio?
515,ckplnz,https://www.reddit.com/r/AskProgramming/comments/ckplnz/is_tripple_equalsigns_unique_to_javascript_or_do/,Is tripple equal-signs unique to javascript or do other languages have a similar equivalent?
516,ckulu9,https://www.reddit.com/r/AskProgramming/comments/ckulu9/what_are_the_must_have_features_of_a_good_static/,What are the must have features of a good static site generator ?
517,ckipqy,https://www.reddit.com/r/AskProgramming/comments/ckipqy/what_is_the_proper_syntax_for_an_if_else/,What is the proper syntax for an if else statement to validate form data in Jsp?
518,ckpea8,https://www.reddit.com/r/AskProgramming/comments/ckpea8/do_you_use_a_crm_to_keep_track_of_potential/,Do you use a CRM to keep track of potential clients / leads?
519,ckqu9g,https://www.reddit.com/r/AskProgramming/comments/ckqu9g/c_program_form_design/,[C#] Program Form Design
520,cku8d4,https://www.reddit.com/r/AskProgramming/comments/cku8d4/how_would_i_go_about_making_a_plugin_for_macos/,How would I go about making a plugin for MacOS iBooks?
521,cn2egc,https://www.reddit.com/r/AskProgramming/comments/cn2egc/infosys_coding_round_1/,Infosys coding round 1.
522,cn3cpu,https://www.reddit.com/r/AskProgramming/comments/cn3cpu/is_server_specific_code_a_bad_idea/,Is server specific code a bad idea ?
523,cn3nrp,https://www.reddit.com/r/AskProgramming/comments/cn3nrp/how_to_configure_a_tor_vpn_on_ec2/,How to configure a TOR VPN on EC2
524,cn4ugj,https://www.reddit.com/r/AskProgramming/comments/cn4ugj/help_the_taxi_problem/,[Help] The taxi problem
525,cn5jfi,https://www.reddit.com/r/AskProgramming/comments/cn5jfi/help_how_would_you_resolve_the_circular_imports/,[Help] How would you resolve the circular imports problem in this particular case (and just in general; as I seem to struggle with this kind of thing all the time)?
526,cn5o4h,https://www.reddit.com/r/AskProgramming/comments/cn5o4h/i_need_a_program_that_automatically_sets_a/,I need a Program that automatically sets a YouTube Video to Public once it has finished Processing all Quality Settings.
527,cn6jys,https://www.reddit.com/r/AskProgramming/comments/cn6jys/help_simple_message_box/,[Help] Simple message box?
528,cn6z97,https://www.reddit.com/r/AskProgramming/comments/cn6z97/xcode_school_app_project/,Xcode school app project
529,cn76na,https://www.reddit.com/r/AskProgramming/comments/cn76na/help_with_system_specs_display_project/,Help with System Specs Display Project
530,cn7ffr,https://www.reddit.com/r/AskProgramming/comments/cn7ffr/how_do_i_automate_food_delivery_orders_through_an/,How do I automate food delivery orders through an app I'm developing
531,cn7m1a,https://www.reddit.com/r/AskProgramming/comments/cn7m1a/windows_programming_is_it_possible_to_have_a/,Windows programming : Is it possible to have a background program catching and killing all focus stealing events?
532,cn8k9q,https://www.reddit.com/r/AskProgramming/comments/cn8k9q/qaqc_testing_how_can_i_break_a_program/,QA/QC Testing: How can I break a program?
533,cnahw2,https://www.reddit.com/r/AskProgramming/comments/cnahw2/react_help_make_sense_of_this_piece_of_code/,[REACT] Help make sense of this piece of code
534,cnaj10,https://www.reddit.com/r/AskProgramming/comments/cnaj10/need_a_coding_language_to_learn/,Need a coding language to learn
535,cnbpog,https://www.reddit.com/r/AskProgramming/comments/cnbpog/what_all_does_a_cookie_with_a_path_of/,"What all does a cookie with a path of "".mywebsite.com"" cover?"
536,cmzpg0,https://www.reddit.com/r/GraphicsProgramming/comments/cmzcqt/having_some_trouble_figuring_out_inigo_quilezs/,Having some trouble figuring out Inigo Quilez's Volumetric sort
537,cn5p6p,https://www.reddit.com/r/AskProgramming/comments/cn5p6p/what_exactly_does_semantic_code_entail/,"What exactly does ""semantic code"" entail?"
538,cn7e23,https://www.reddit.com/r/AskProgramming/comments/cn7e23/whats_the_difference_between_an_algorithm_and_a/,What's the difference between an algorithm and a function?
539,cn45la,https://www.reddit.com/r/AskProgramming/comments/cn45la/scheduling_cron_tasks_within_a_cron_task_nodejs/,Scheduling Cron Tasks within a Cron Task (Nodejs)
540,cn6x4z,https://www.reddit.com/r/AskProgramming/comments/cn6x4z/help_on_a_pi_program_to_display_system_specs/,Help on a Pi Program to display System Specs
541,cn80ab,https://www.reddit.com/r/AskProgramming/comments/cn80ab/writing_to_an_excel_file_using_c/,Writing to an excel file using C++?
542,cn8yyk,https://www.reddit.com/r/AskProgramming/comments/cn8yyk/stupid_noob_question/,Stupid noob question.
543,cncust,https://www.reddit.com/r/AskProgramming/comments/cncust/what_is_the_name_of_websites_like_boredbutton/,What is the name of websites like boredbutton?
544,cndluw,https://www.reddit.com/r/AskProgramming/comments/cndluw/why_do_most_production_code_appear_to_use_arrays/,"Why do most production code appear to use arrays over vectors, even when vectors may be more beneficial?"
545,cnc5mx,https://www.reddit.com/r/AskProgramming/comments/cnc5mx/why_is_my_bot_being_detected_by_the_website/,Why is my bot being detected by the website?
546,cs9dij,https://www.reddit.com/r/AskProgramming/comments/cs9dij/i_need_help_uploading_mypassport_hardrive_to/,I need help uploading MyPassport hardrive to Dropbox
547,csac6i,https://www.reddit.com/r/AskProgramming/comments/csac6i/trying_to_write_a_script_that_runs_an_exe_with/,"Trying to write a script that runs an exe with command line arguments, and then puts in the required user input"
548,csb847,https://www.reddit.com/r/AskProgramming/comments/csb847/create_buzzfeed_quiz_in_my_website/,Create Buzzfeed quiz in my website
549,csenb5,https://www.reddit.com/r/AskProgramming/comments/csenb5/draw_a_half_dashed_line_shape_in_java_with/,Draw a half dashed line shape in Java with Graphics 2D?
550,csez3d,https://www.reddit.com/r/AskProgramming/comments/csez3d/game_of_life_starting_patterns/,Game of Life starting patterns
551,csfxm6,https://www.reddit.com/r/AskProgramming/comments/csfxm6/is_it_possible_to_store_more_than_one_variable/,Is it possible to store more than one variable inside a specific array position?
552,csgrm5,https://www.reddit.com/r/AskProgramming/comments/csgrm5/how_does_a_3d_printer_works_with_the_data_he_was/,How does a 3D printer works with the data he was given ?
553,cshsdp,https://www.reddit.com/r/AskProgramming/comments/cshsdp/js_how_to_have_an_asynchronous_function_that/,[JS] How to have an asynchronous function that listens for any button press
554,csi8hz,https://www.reddit.com/r/AskProgramming/comments/csi8hz/random_403_errors_from_mvc_with_angular/,RANDOM 403 ERRORS FROM MVC WITH ANGULAR
555,csio1k,https://www.reddit.com/r/AskProgramming/comments/csio1k/im_searching_for_a_platform_for_alerts_or/,I’m searching for a platform for alerts or notifications for code updates between teams in my company!
556,csitsx,https://www.reddit.com/r/AskProgramming/comments/csitsx/what_am_i_doing_wrong/,What am I doing wrong?
557,csk5oy,https://www.reddit.com/r/AskProgramming/comments/csk5oy/best_framework_to_create_a_program_that_can_hook/,Best framework to create a program that can hook into Bitmex API/Websocket
558,csltz5,https://www.reddit.com/r/AskProgramming/comments/csltz5/whats_behind_the_current_antioop_stance_by_some/,What's behind the current anti-OOP stance by some developers?
559,csm1ag,https://www.reddit.com/r/AskProgramming/comments/csm1ag/python_exercise_quicksort_results_in/,Python Exercise Quicksort results in RecursionError: maximum recursion depth exceeded in comparison
560,csnfnh,https://www.reddit.com/r/AskProgramming/comments/csnfnh/suggestions_for_multithreadedhighly_parallel/,suggestions for multithreaded/highly parallel projects?
561,csnom0,https://www.reddit.com/r/AskProgramming/comments/csnom0/nonqwerty_keyboard_layouts/,Non-QWERTY keyboard layouts?
562,csoacu,https://www.reddit.com/r/AskProgramming/comments/csoacu/will_you_pay_for_ai_that_directs_you_in_the_code/,Will you pay for AI that directs you in the code?
563,csohcy,https://www.reddit.com/r/AskProgramming/comments/csohcy/struggle_with_an_algorithm_question/,Struggle with an algorithm question
564,csoqcj,https://www.reddit.com/r/AskProgramming/comments/csoqcj/nodejs_application_hosting_on_virtualbox_ubuntu/,Nodejs application hosting on virtualbox ubuntu
565,csp2t4,https://www.reddit.com/r/AskProgramming/comments/csp2t4/programming_an_antialiased_wave_form/,Programming an antialiased wave form
566,cspqtk,https://www.reddit.com/r/AskProgramming/comments/cspqtk/is_it_possible_to_add_a_register_to_view_part_of/,"Is it possible to add a ""register to view"" part of my site thats mostly HTML?"
567,cs9zka,https://www.reddit.com/r/AskProgrammers/comments/cs9qy0/any_advice_on_where_i_can_find_skilled_freelance/,Any advice on how/where to find a programmer with the right skills is greatly appreciated.
568,csf3m8,https://www.reddit.com/r/AskProgramming/comments/csf3m8/cant_start_basic_program_in_visual_studio_unable/,Can't start basic program in visual studio. (Unable to start program C:\Users\ 11896\source\repos\Hello World\Debug\Hello World.exe
569,csgszy,https://www.reddit.com/r/AskProgramming/comments/csgszy/running_an_executable_within_an_executable/,Running an Executable Within an Executable
570,csh2lj,https://www.reddit.com/r/AskProgramming/comments/csh2lj/c_binary_serialization_and_database_display/,[C#] Binary Serialization and Database Display
571,cskeaq,https://www.reddit.com/r/AskProgramming/comments/cskeaq/how_to_remove_everything_from_a_specific/,How to remove everything from a specific character to other in a Python string
572,csds60,https://www.reddit.com/r/AskProgramming/comments/csds60/spotifyapiresults_not_as_intuitive_as/,Spotify-API-Results not as intuitive as Spotify-Application-Search Results
573,cvx0tm,https://www.reddit.com/r/AskProgramming/comments/cvx0tm/how_do_sites_like_instapage_work_with_white/,How do sites like InstaPage work with white labeling?
574,cvy2wf,https://www.reddit.com/r/AskProgramming/comments/cvy2wf/how_do_i_move_projects_from_an_old_visual_studio/,How do I move projects from an old Visual Studio version to a new one?
575,cvz75w,https://www.reddit.com/r/AskProgramming/comments/cvz75w/recommendations_for_coding_boot_camps_in_sd/,Recommendations for Coding Boot Camps in SD?
576,cw14op,https://www.reddit.com/r/AskProgramming/comments/cw14op/will_speculative_execution_take_any_time_at_all/,Will speculative execution take any time at all when it guesses right?
577,cw2rvp,https://www.reddit.com/r/AskProgramming/comments/cw2rvp/cshell_help/,Cshell help
578,cw3k4c,https://www.reddit.com/r/AskProgramming/comments/cw3k4c/in_creating_a_basic_nodejs_application_with_per/,"In creating a basic NodeJS application with per user templating and authentication, would you use a standard CMS project or a custom build?"
579,cw4jg6,https://www.reddit.com/r/AskProgramming/comments/cw4jg6/beginner_simplist_way_to_post_url_parameters_to/,Beginner. Simplist way to post url parameters to database?
580,cw56kk,https://www.reddit.com/r/AskProgramming/comments/cw56kk/are_there_any_worthwhile_obfuscation_alternatives/,Are there any worthwhile obfuscation alternatives?
581,cw5x0v,https://www.reddit.com/r/AskProgramming/comments/cw5x0v/i_have_to_learn_python_and_im_not_sure_which_tool/,"I have to learn python and I'm not sure which tool is the best to do it, any suggestions?"
582,cw6hwt,https://www.reddit.com/r/AskProgramming/comments/cw6hwt/stitchdatacom_anyone_have_experiance_with_it/,Stitchdata.com anyone have experiance with it?
583,cw6mjn,https://www.reddit.com/r/AskProgramming/comments/cw6mjn/can_you_do_property_inheritance_with_rust/,Can you do PROPERTY inheritance with Rust?
584,cw8olq,https://www.reddit.com/r/AskProgramming/comments/cw8olq/ejbs_are_not_contextual_by_nature/,"""EJBs are not contextual by nature"""
585,cw93yt,https://www.reddit.com/r/AskProgramming/comments/cw93yt/visual_basic/,Visual basic
586,cw9kjc,https://www.reddit.com/r/AskProgramming/comments/cw9kjc/help_a_physician_develop_a_tool_to_make_his_daily/,Help a physician develop a tool to make his daily typing routine more efficient
587,cw9mvu,https://www.reddit.com/r/AskProgramming/comments/cw9mvu/recently_hired_in_devops_despite_having/,Recently Hired in DevOps despite having electrical engineering background
588,cwaeyc,https://www.reddit.com/r/AskProgramming/comments/cwaeyc/animosity_towards_frontend/,Animosity towards front-end?
589,cwalf0,https://www.reddit.com/r/AskProgramming/comments/cwalf0/why_is_my_terminal_slow_when_changing_directories/,Why is my Terminal slow when changing directories?
590,cwallr,https://www.reddit.com/r/AskProgramming/comments/cwallr/changed_a_vector_of_pointers_to_a_vector_of/,"Changed a vector of pointers to a vector of objects, and now it crashes. Why? (C++)"
591,cwb3am,https://www.reddit.com/r/AskProgramming/comments/cwb3am/java_or_c/,Java or C# ?
592,cw1jyl,https://www.reddit.com/r/AskProgramming/comments/cw1jyl/what_are_some_features_you_are_missing_in_your_ide/,What are some features you are missing in your IDE?
593,cwaj7t,https://www.reddit.com/r/enviroaction/comments/cw9upw/what_can_a_programmer_python_do_for_the/,"What can a programmer (Python) do for the environment? (Crossposted from r/EnviroAction. Even if I know it is not a strictly programming issue, please do not remove, is important for all of us)"
594,cw3nyb,https://www.reddit.com/r/AskProgramming/comments/cw3nyb/why_is_javascript_so_weird_is_this_the_best_we/,Why is javascript so weird? Is this the best we got? Will it be replaced some time? Halp
595,cpkwo4,https://www.reddit.com/r/AskProgramming/comments/cpkwo4/what_programming_languages_would_you_recommend_to/,What programming languages would you recommend to someone wanting to work in this field?
596,cpny6q,https://www.reddit.com/r/AskProgramming/comments/cpny6q/my_brothers_cell_phone_has_a_resolution_of/,"My brother's cell phone has a resolution of 1440x3040 so even in portrait view, it loads the CSS media query for desktops. Can you stop this from happening?"
597,cpofbn,https://www.reddit.com/r/AskProgramming/comments/cpofbn/java_how_to_read_approved_option_from/,JAVA - How to read approved option from JFileChooser and then append it to a file?
598,cpp1sc,https://www.reddit.com/r/AskProgramming/comments/cpp1sc/looking_to_be_guided_in_the_right_direction_on_a/,Looking to be guided in the right direction on a project
599,cpphd1,https://www.reddit.com/r/AskProgramming/comments/cpphd1/angularjs_1_cors_problem/,AngularJS 1.? CORS problem
600,cprhoi,https://www.reddit.com/r/AskProgramming/comments/cprhoi/how_robust_is_asp_net_web_api_when_building_an_api/,How robust is ASP NET Web API when building an API?
601,cpstrv,https://www.reddit.com/r/AskProgramming/comments/cpstrv/can_someone_pls_help_me_in_finding_where_is/,can someone pls help me in finding where is problem in my code that it is giving floating point exception.
602,cpsvoj,https://www.reddit.com/r/AskProgramming/comments/cpsvoj/does_programming_get_easier/,Does programming get easier?
603,cpsxbi,https://www.reddit.com/r/AskProgramming/comments/cpsxbi/how_to_calculate_time_complexity_of_each_line_in/,How to calculate time complexity of each line in algorithms?
604,cptay9,https://www.reddit.com/r/AskProgramming/comments/cptay9/how_to_fix_this_in_python/,How to fix this in python?
605,cpuudw,https://www.reddit.com/r/AskProgramming/comments/cpuudw/are_you_polyglot_or_monoglot/,Are you polyglot or monoglot?
606,cpuwhg,https://www.reddit.com/r/AskProgramming/comments/cpuwhg/is_there_a_comprehensive_taxonomy_of_software/,Is there a comprehensive taxonomy of software available?
607,cpy33f,https://www.reddit.com/r/AskProgramming/comments/cpy33f/error_too_many_characters_in_character_constant/,Error: Too many characters in character constant
608,cpz8c4,https://www.reddit.com/r/AskProgramming/comments/cpz8c4/what_is_better/,What is better?
