,post_id,post_url,post_title
0,crfnta,https://www.reddit.com/r/AskProgramming/comments/crfnta/what_is_the_best_process_to_learn/,What is the best process to learn
1,crg5jl,https://www.reddit.com/r/AskProgramming/comments/crg5jl/companys_programming_doomed/,Company's Programming doomed?
2,cri08z,https://www.reddit.com/r/AskProgramming/comments/cri08z/vrat_development/,Vr/at development?
3,crilpq,https://www.reddit.com/r/AskProgramming/comments/crilpq/running_a_simple_sed_command_on_text_fields_in_a/,Running a simple sed command on text fields in a remote mysql table
4,crj1ik,https://www.reddit.com/r/AskProgramming/comments/crj1ik/any_document_paper_video_or_sourcecode_of_a/,"Any document, paper, video or sourcecode of a lossless (de)compression program with *in-depth* explanation?"
5,crju6l,https://www.reddit.com/r/AskProgramming/comments/crju6l/connectivity_issues_question/,Connectivity issues question
6,crkotf,https://www.reddit.com/r/AskProgramming/comments/crkotf/is_programming_getting_oversaturated/,Is programming getting oversaturated?
7,crkudc,https://www.reddit.com/r/AskProgramming/comments/crkudc/how_is_this_possible/,How is this possible ?
8,crmeyo,https://www.reddit.com/r/AskProgramming/comments/crmeyo/conceptual_design_check/,Conceptual design check
9,crob3h,https://www.reddit.com/r/AskProgramming/comments/crob3h/understanding_state_and_updates_in_react/,Understanding State and Updates in React
10,croymw,https://www.reddit.com/r/AskProgramming/comments/croymw/how_can_i_get_alert_when_a_new_post_get_added_to/,How can i get alert when a new post get added to an Instagram profile?
11,crpkqy,https://www.reddit.com/r/AskProgramming/comments/crpkqy/visual_studio_question_execute_code_on_checkin/,Visual Studio question - execute code on checkin?
12,crpnbl,https://www.reddit.com/r/AskProgramming/comments/crpnbl/how_can_i_use_instagram_api_to_post_a_comment/,how can i use Instagram API to post a comment whenever a new post happens?
13,crq4ze,https://www.reddit.com/r/AskProgramming/comments/crq4ze/why_isnt_my_navigation_menu_aligning_to_the_right/,Why isn't my navigation menu aligning to the right? (CSS Question)
14,crt0l8,https://www.reddit.com/r/AskProgramming/comments/crt0l8/is_there_any_way_to_access_facebook_notifications/,Is there any way to access facebook notifications remotely?
15,crhtqv,https://www.reddit.com/r/AskProgramming/comments/crhtqv/getting_pytesseract_to_work_on_very_easy_image/,Getting PyTesseract to Work on Very Easy Image...
16,cromdz,https://www.reddit.com/r/AskProgramming/comments/cromdz/is_it_possible_to_increase_the_timeout_value_for/,Is it possible to increase the timeout value for Angular HttpClient?
17,crovzt,https://www.reddit.com/r/AskProgramming/comments/crovzt/is_it_possible_to_increase_the_timeout_value_for/,Is it possible to increase the timeout value for Angular HttpClient?
18,crq550,https://www.reddit.com/r/AskProgramming/comments/crq550/test_post/,Test post
19,crrqra,https://www.reddit.com/r/AskProgramming/comments/crrqra/having_trouble_getting_user_input_from_js_form/,Having trouble getting user input from JS form - event.preventDefault is not working
20,clq9ba,https://www.reddit.com/r/AskProgramming/comments/clq9ba/super_beginner_python_question/,Super Beginner Python Question
21,clqrb6,https://www.reddit.com/r/AskProgramming/comments/clqrb6/regex_using_java_split_matching_one_or_more/,"REGEX - Using java split, matching one or more occurrences for a set of characters, but TWO or more occurrences for another character"
22,clr7lm,https://www.reddit.com/r/AskProgramming/comments/clr7lm/good_aspnet_core_book/,Good ASP.NET Core book
23,clroa5,https://www.reddit.com/r/AskProgramming/comments/clroa5/could_someone_help_me_out_and_explain_this_matlab/,Could someone help me out and explain this MATLAB code to me?
24,clrsiq,https://www.reddit.com/r/AskProgramming/comments/clrsiq/how_can_do_this_in_c/,How can do this in C++;
25,clufz7,https://www.reddit.com/r/AskProgramming/comments/clufz7/pseudocode_flowchart_help/,Pseudocode Flowchart Help
26,clwmhp,https://www.reddit.com/r/AskProgramming/comments/clwmhp/another_hate_my_job_want_to_switch_careers_post/,"Another ""hate my job want to switch careers"" post"
27,clwzsw,https://www.reddit.com/r/AskProgramming/comments/clwzsw/replace_an_url_with_another_url_with_a_script_in/,Replace an url with another url with a script in the bookmarks
28,clxx1g,https://www.reddit.com/r/AskProgramming/comments/clxx1g/interface_for_online_store_needed/,Interface for online store needed
29,clxz2t,https://www.reddit.com/r/AskProgramming/comments/clxz2t/installing_eclipse/,installing eclipse
30,clye7h,https://www.reddit.com/r/AskProgramming/comments/clye7h/can_this_function_be_converted_to_tail_recursion/,Can this function be converted to tail recursion?
31,cm015h,https://www.reddit.com/r/AskProgramming/comments/cm015h/do_websites_like_twitter_have_extra_protection/,Do websites like twitter have extra protection reserved for important users like the POTUS?
32,cm0r57,https://www.reddit.com/r/AskProgramming/comments/cm0r57/doing_bidirectional_and_forward_version_of/,"Doing Bidirectional and Forward version of Dijkstra's Algorithm, but processing time approximately the same even with 1,000+ iterations. Am I approaching this wrong?"
33,cm1agr,https://www.reddit.com/r/AskProgramming/comments/cm1agr/whatever_happened_to_perl/,Whatever happened to Perl?
34,cm2etd,https://www.reddit.com/r/AskProgramming/comments/cm2etd/how_does_a_native_interface_work/,How does a native interface work ?
35,cm3fhy,https://www.reddit.com/r/AskProgramming/comments/cm3fhy/sending_desktop_application_error_reports/,Sending Desktop Application Error Reports
36,clr7gv,https://www.reddit.com/r/AskProgramming/comments/clr7gv/probably_super_perspective_question/,Probably super perspective question
37,clym3s,https://www.reddit.com/r/AskProgramming/comments/clym3s/what_laptop_is_great_for_programming_to_creating/,"What laptop is great for programming to creating games, websites, apps, that it would not lose battery quickly and it would freeze up. I want to do different projects so i could get practice."
38,cm1pda,https://www.reddit.com/r/AskProgramming/comments/cm1pda/need_advice_on_customizing_online_store/,Need Advice on Customizing Online Store
39,cu5zrb,https://www.reddit.com/r/AskProgramming/comments/cu5zrb/help_identifying_events_from_a_picture/,Help identifying events from a picture.
40,cu6axs,https://www.reddit.com/r/AskProgramming/comments/cu6axs/response_headers_return_texthtml_instead_of/,Response headers return text/html instead of application/json
41,cu736v,https://www.reddit.com/r/AskProgramming/comments/cu736v/sqlplus_not_interpreting_a_statement_correctly/,SQLPlus not interpreting a statement correctly
42,cu7gnw,https://www.reddit.com/r/AskProgramming/comments/cu7gnw/what_does_it_mean_to_administrate_over_a_series/,"What does it mean to ""administrate"" over a series of computers?"
43,cu93jo,https://www.reddit.com/r/AskProgramming/comments/cu93jo/is_there_any_way_for_a_mobile_app_to_receive_and/,Is there any way for a mobile app to receive and send data in the background to a different app which is being used at the time?
44,cu9wfs,https://www.reddit.com/r/AskProgramming/comments/cu9wfs/looking_to_create_an_algorithm_that_shows_20/,"Looking to create an algorithm that shows 20 images on a certain event call, with 50% of images being based on a user’s interests, and the other 50% being random."
45,cuaty6,https://www.reddit.com/r/AskProgramming/comments/cuaty6/what_is_the_term_for_the_icons_that_are_in_the/,What is the term for the icons that are in the bottom right corner of the windows taskbar?
46,cuazkn,https://www.reddit.com/r/AskProgramming/comments/cuazkn/phone_bot_those_auto_switches_when_user_presses_a/,Phone Bot | Those auto switches when user presses a number during call
47,cubfy3,https://www.reddit.com/r/AskProgramming/comments/cubfy3/music_charts_api/,Music charts api
48,cubhs3,https://www.reddit.com/r/AskProgramming/comments/cubhs3/bash_script_bug/,Bash script bug
49,cubm1m,https://www.reddit.com/r/AskProgramming/comments/cubm1m/kademlia_can_two_nodes_exchange_messages_directly/,Kademlia | Can two nodes exchange messages directly?
50,cubyce,https://www.reddit.com/r/AskProgramming/comments/cubyce/need_some_help_understanding_how_to_design/,Need some help understanding how to design Server-to-Server Authentication
51,cuc4f7,https://www.reddit.com/r/AskProgramming/comments/cuc4f7/starting_competitive_coding/,Starting Competitive coding
52,cucr6a,https://www.reddit.com/r/AskProgramming/comments/cucr6a/i_want_to_store_an_int_value_before_closing_my/,I want to store an int value before closing my UWP app
53,cugqlh,https://www.reddit.com/r/AskProgramming/comments/cugqlh/how_does_reserving_space_for_variables_work/,How does reserving space for variables work?
54,cuguch,https://www.reddit.com/r/AskProgramming/comments/cuguch/question_about_multiple_processes_and_pipes/,Question about Multiple Processes and Pipes
55,cuh5qy,https://www.reddit.com/r/AskProgramming/comments/cuh5qy/code_review_request_for_a_python_extension/,Code review request for a Python extension written in C
56,cuha3n,https://www.reddit.com/r/AskProgramming/comments/cuha3n/automating_tasks_between_outlook_and_onenote/,Automating tasks between outlook and onenote
57,cuial6,https://www.reddit.com/r/AskProgramming/comments/cuial6/r_script_editing_data_that_is_variant_in_size/,R script - editing data that is variant in size
58,cukh6e,https://www.reddit.com/r/AskProgramming/comments/cukh6e/winapi_after_creating_a_remote_thread_in_an/,"Winapi - After creating a remote thread in an external process, can you see the status/return of the lpStartAddress function?"
59,cu8ni6,https://www.reddit.com/r/AskProgramming/comments/cu8ni6/python_best_practices_using_global_variables_in/,[Python] Best practices using global variables in python script?
60,cu8oxr,https://www.reddit.com/r/AskProgramming/comments/cu8oxr/r_script_how_to_organize_data_set_provided_by/,R script - how to organize data set provided by .json into workable categories
61,cuat9d,https://www.reddit.com/r/AskProgramming/comments/cuat9d/why_was_i_able_to_beat_the_range_check_that_one/,Why was I able to beat the range check that one time?
62,cudn9o,https://www.reddit.com/r/AskProgramming/comments/cudn9o/i_cant_get_a_buttons_event_listener_to_fire_js/,"I can't get a button's event listener to fire (JS, Bootstrap)"
63,cuk3w7,https://www.reddit.com/r/AskProgramming/comments/cuk3w7/questions_about_architecture_and_security_of_a/,Questions about architecture and security of a Web app + Native app consuming REST APIs
64,crxtr4,https://www.reddit.com/r/AskProgramming/comments/crxtr4/online_lesson_suggestions/,Online lesson suggestions
65,cry4py,https://www.reddit.com/r/AskProgramming/comments/cry4py/how_do_i_start_making_an_internetbased/,How do I start making an internet-based application that can be accessed by people in my company?
66,crzz6x,https://www.reddit.com/r/AskProgramming/comments/crzz6x/what_should_i_do_to_become_really_good_at/,What should i do to become really good at engineering
67,cs1ghz,https://www.reddit.com/r/AskProgramming/comments/cs1ghz/why_do_i_suck_at_using_docker_and_docker_compose/,Why do I suck at using Docker and Docker Compose?
68,cs2d5x,https://www.reddit.com/r/AskProgramming/comments/cs2d5x/where_to_learn_swift_development/,Where to learn Swift development
69,cs2siz,https://www.reddit.com/r/AskProgramming/comments/cs2siz/how_to_design_a_system_which_request_data_from_a/,How to design a system which request data from a limited requests APIs?
70,cs441w,https://www.reddit.com/r/AskProgramming/comments/cs441w/regular_expressions_why_is_this_different/,Regular Expressions: Why is this different?
71,cs5rlm,https://www.reddit.com/r/AskProgramming/comments/cs5rlm/dictionary_with_pronunciation_api/,Dictionary with pronunciation API
72,cs6afu,https://www.reddit.com/r/AskProgramming/comments/cs6afu/sysadmin_trying_to_become_devop_task/,Sysadmin trying to become Devop - Task
73,cs6evv,https://www.reddit.com/r/AskProgramming/comments/cs6evv/excel_needing_to_find_cases_where_3_out_of_5/,Excel needing to find cases where 3 out of 5 numbers in a row are greater than or equal to .45
74,cs78f8,https://www.reddit.com/r/AskProgramming/comments/cs78f8/whats_wrong_with_this_line_of_code/,Whats wrong with this line of code?
75,cs7slk,https://www.reddit.com/r/AskProgramming/comments/cs7slk/how_do_i_create_my_own_physical_server/,How do I create my own physical server?
76,cs86rj,https://www.reddit.com/r/AskProgramming/comments/cs86rj/no_green_play_button_in_vs_code/,No Green Play Button in VS Code
77,cs8gah,https://www.reddit.com/r/AskProgramming/comments/cs8gah/open_furbyhack_furby_info_downloads_help/,Open Furby/Hack Furby Info? Downloads? Help?
78,crzhwv,https://www.reddit.com/r/AskProgramming/comments/crzhwv/why_are_html_files_with_pictures_so_insanely_small/,Why are HTML files with pictures so insanely small?
79,cnx9gi,https://www.reddit.com/r/AskProgramming/comments/cnx9gi/i_wrote_a_switch_statement_in_lua_does_it_work/,"I wrote a switch statement in Lua, does it work like I think I does"
80,cnxp6y,https://www.reddit.com/r/AskProgramming/comments/cnxp6y/why_isnt_margin_working_on_this_one_section_of/,Why isn't margin working on this one section of div elements?
81,cny2ul,https://www.reddit.com/r/AskProgramming/comments/cny2ul/is_it_okay_if_i_learn_elisp_as_my_first/,Is it okay if I learn (e)lisp as my first programming language?
82,cnz4oc,https://www.reddit.com/r/AskProgramming/comments/cnz4oc/programmers_of_reddit_convince_me_to_use_your/,"Programmers of Reddit, convince me to use your code editor"
83,cnzt8t,https://www.reddit.com/r/AskProgramming/comments/cnzt8t/just_a_reminder/,Just a Reminder
84,co03b1,https://www.reddit.com/r/AskProgramming/comments/co03b1/number_generator_where_you_can_define_constants/,Number generator where you can define constants
85,co0fzm,https://www.reddit.com/r/AskProgramming/comments/co0fzm/how_to_go_about_developing_an_api_which/,How to go about developing an API which integrates a MySQL database and Xero?
86,co1s7j,https://www.reddit.com/r/AskProgramming/comments/co1s7j/what_is_the_term_for_making_a_relation_between/,What is the term for making a relation between spoken languages and computer programming in general?
87,co1v10,https://www.reddit.com/r/AskProgramming/comments/co1v10/possible_for_a_program_to_read_compute_and/,"Possible for a program to read, compute and compile information form PDF?"
88,co2kaw,https://www.reddit.com/r/AskProgramming/comments/co2kaw/what_do_you_guys_do_to_keep_yourself_motivated/,What do you guys do to keep yourself motivated when you're used to working in a face paced environment?
89,co3axs,https://www.reddit.com/r/AskProgramming/comments/co3axs/how_to_learn_to_know_which_frameworklibrary_is/,How to learn to know which framework/library is best for which scenario?
90,co5e48,https://www.reddit.com/r/AskProgramming/comments/co5e48/serious_how_do_you_not_jerk_off_when_working_on/,[serious] how do you not jerk off when working on personal project ?
91,co5l82,https://www.reddit.com/r/AskProgramming/comments/co5l82/what_is_this_concept_of_parentsubclass_expansion/,What is this concept of parent/subclass expansion (python code inside)?
92,co6ggi,https://www.reddit.com/r/AskProgramming/comments/co6ggi/why_has_my_terminal_suddenly_got_this_line_at_the/,Why has my terminal suddenly got this line at the beginning?
93,co85wu,https://www.reddit.com/r/AskProgramming/comments/co85wu/whats_the_best_to_automate_video_view_counts_from/,What's the best to automate video view counts from LinkedIn &amp; Twitter to a Google Sheets document?
94,co87ta,https://www.reddit.com/r/AskProgramming/comments/co87ta/storing_config_files/,Storing config files
95,co8rfs,https://www.reddit.com/r/AskProgramming/comments/co8rfs/visual_studio_outlook_addin_help_stupid_button/,Visual Studio - Outlook Add-In Help - STUPID BUTTON
96,co8usu,https://www.reddit.com/r/AskProgramming/comments/co8usu/need_help_with_pulling_and_comparing_stock_market/,Need help with pulling and comparing stock market data
97,co9ug9,https://www.reddit.com/r/AskProgramming/comments/co9ug9/looking_for_resources_on_how_to_create_this/,Looking for resources on how to create this calculator
98,coaah8,https://www.reddit.com/r/AskProgramming/comments/coaah8/jcreator_pro_does_not_open_after_it_has_been/,JCreator Pro does not open after it has been installed
99,cnvd2n,https://www.reddit.com/r/AskProgramming/comments/cnvd2n/java_ide_for_beginner/,Java IDE for beginner
100,cnwx5v,https://www.reddit.com/r/AskProgramming/comments/cnwx5v/what_is_a_static_ban/,What is a static ban?
101,cnziug,https://www.reddit.com/r/AskProgramming/comments/cnziug/please_help_a_lost_student/,Please help a lost student :(
102,co4rdo,https://www.reddit.com/r/AskProgramming/comments/co4rdo/where_do_i_start_programming/,Where do I start programming?
103,cxpofd,https://www.reddit.com/r/AskProgramming/comments/cxpofd/i_have_an_idea_but_i_need_help/,I have an idea but I need help
104,cxq6cx,https://www.reddit.com/r/AskProgramming/comments/cxq6cx/whats_with_pixel_size_when_plotting_data/,What's with pixel size when plotting data?
105,cxqwgt,https://www.reddit.com/r/AskProgramming/comments/cxqwgt/disadvantages_of_flutter/,Disadvantages of Flutter
106,cxrvqt,https://www.reddit.com/r/AskProgramming/comments/cxrvqt/is_it_possible_to_scrape_source_code_for_web/,Is it possible to scrape source code for web app/tool
107,cxrzj9,https://www.reddit.com/r/AskProgramming/comments/cxrzj9/how_can_i_make_a_bot_like_this/,How can I make a bot like this?
108,cxs59u,https://www.reddit.com/r/AskProgramming/comments/cxs59u/what_innovative_project_ideas_do_you_have_ap/,What innovative project ideas do you have AP ?
109,cxtr0q,https://www.reddit.com/r/AskProgramming/comments/cxtr0q/i_need_help_with_r/,I need help with R
110,cxtwfn,https://www.reddit.com/r/AskProgramming/comments/cxtwfn/building_a_linux_shell_in_c_for_my_portfolio_as_a/,Building a linux shell in c++ for my portfolio as a student.
111,cxua96,https://www.reddit.com/r/AskProgramming/comments/cxua96/question_about_a_file_windows/,Question about a file (Windows)
112,cxv7qu,https://www.reddit.com/r/AskProgramming/comments/cxv7qu/inline_function_in_cpp/,Inline Function in CPP
113,cxvk7s,https://www.reddit.com/r/AskProgramming/comments/cxvk7s/i_want_someone_to_guide_me_in_competitive/,I want someone to guide me in competitive programming
114,cxx3tl,https://www.reddit.com/r/AskProgramming/comments/cxx3tl/what_do_i_need_to_know_about_to_handoptimise_this/,What do I need to know about to hand-optimise this function?
115,cxy2gj,https://www.reddit.com/r/AskProgramming/comments/cxy2gj/bigo_notation_question/,Big-O notation question
116,cxz1nr,https://www.reddit.com/r/AskProgramming/comments/cxz1nr/c_read_specific_line_in_text_file/,[C] Read specific line in text file
117,cxz6aw,https://www.reddit.com/r/AskProgramming/comments/cxz6aw/why_use_angularjs/,Why use AngularJS?
118,cxzjko,https://www.reddit.com/r/AskProgramming/comments/cxzjko/ios_programming_language/,IOS Programming Language
119,cy185j,https://www.reddit.com/r/AskProgramming/comments/cy185j/i_wanna_know_what_to_learn_before_applying_to_a/,I wanna know what to learn before applying to a specific job
120,cy1f5u,https://www.reddit.com/r/AskProgramming/comments/cy1f5u/beginner_coder/,Beginner Coder
121,cy282f,https://www.reddit.com/r/AskProgramming/comments/cy282f/no_text_showing_up_in_bash_terminal_in_vs_code_on/,No text showing up in bash terminal in VS Code on W Windows
122,cy2jl9,https://www.reddit.com/r/AskProgramming/comments/cy2jl9/how_can_i_code_a_conflictfree_event_schedule/,How can I code a conflict-free event schedule generator using algorithms?
123,cy2xar,https://www.reddit.com/r/AskProgramming/comments/cy2xar/eli5_what_is_xml_and_how_is_it_related_to_html/,ELI5: What is XML and how is it related to HTML?
124,ctpxct,https://www.reddit.com/r/AskProgramming/comments/ctpxct/im_a_desktop_developer_whats_the_easiest_platform/,I'm a desktop developer - what's the easiest platform to create web interfaces for customers who want them?
125,ctu6b9,https://www.reddit.com/r/AskProgramming/comments/ctu6b9/junk_data_from_string/,Junk Data from String
126,ctugl1,https://www.reddit.com/r/AskProgramming/comments/ctugl1/how_to_persist_variables_in_spring_boot/,How to persist variables in Spring Boot?
127,ctxml1,https://www.reddit.com/r/AskProgramming/comments/ctxml1/private_audio_streaming/,Private audio streaming
128,cty9e7,https://www.reddit.com/r/AskProgramming/comments/cty9e7/problems_with_integration_of_leaflet_plugins/,Problems with integration of Leaflet Plugins
129,ctzbqt,https://www.reddit.com/r/AskProgramming/comments/ctzbqt/sass_suddenly_not_working_in_terminal_keep/,"SASS suddenly not working in Terminal; keep getting ""command not found"" no matter what I do. Any suggestions?"
130,ctzrm6,https://www.reddit.com/r/AskProgramming/comments/ctzrm6/php_exercise/,PHP exercise
131,cu18aw,https://www.reddit.com/r/AskProgramming/comments/cu18aw/recommendation_for_a_java_course_book_that_is_not/,Recommendation for A java course / book that is not for beginners?
132,cu25z8,https://www.reddit.com/r/AskProgramming/comments/cu25z8/opening_specific_file_using_windows_form/,Opening specific file using Windows Form?
133,cu2mor,https://www.reddit.com/r/AskProgramming/comments/cu2mor/app_to_alert_me_when_a_website_has_a_spot_for_a/,App to alert me when a website has a spot for a road test appointment?
134,cu3gm0,https://www.reddit.com/r/AskProgramming/comments/cu3gm0/borland_command_line_errors/,Borland command line errors
135,cu3lke,https://www.reddit.com/r/AskProgramming/comments/cu3lke/options_for_frontend_for_a_c_backend/,Options for frontend for a C++ backend?
136,cu0ex0,https://www.reddit.com/r/AskProgramming/comments/cu0ex0/has_anyone_ever_used_strokescribe_barcode_addin/,Has anyone ever used Strokescribe barcode addin for VB/C#?
137,coq2oc,https://www.reddit.com/r/AskProgramming/comments/coq2oc/simple_csv_automation_task_on_macos/,Simple csv automation task on MacOS
138,coqo8d,https://www.reddit.com/r/AskProgramming/comments/coqo8d/getting_started_from_scratch_with_a_relatively/,Getting started from scratch with a relatively clear goal. Help to build a path to follow?
139,corn5x,https://www.reddit.com/r/AskProgramming/comments/corn5x/looking_for_programming_ideas_to_use_the_data_i/,Looking for programming ideas to use the data I have logged
140,cosi1s,https://www.reddit.com/r/AskProgramming/comments/cosi1s/what_is_the_doctors_without_borders_equivalent/,"What is the ""doctors without borders"" equivalent for programming?"
141,cosmgb,https://www.reddit.com/r/AskProgramming/comments/cosmgb/how_to_automating_search_through_keywords/,How to automating search through keywords
142,cotuo6,https://www.reddit.com/r/AskProgramming/comments/cotuo6/want_to_sort_books_based_on_subjects_ex_linux/,"Want to sort books based on subjects. Ex: (Linux Bible, Linux Cookbook) -&gt; Linux, (Python Programming, Intro Python...) -&gt; Python"
143,coupu9,https://www.reddit.com/r/AskProgramming/comments/coupu9/looking_for_guide_to_go_from_c_to_c/,Looking for Guide to go from C to C++?
144,cov8j9,https://www.reddit.com/r/AskProgramming/comments/cov8j9/where_is_the_best_place_to_learn_programming/,"Where is the best place to learn programming? Books versus online courses, etc?"
145,covbdq,https://www.reddit.com/r/AskProgramming/comments/covbdq/what_makes_a_programming_book_useful_and_helpful/,"What makes a programming book useful and helpful, in your opinion?"
146,covckp,https://www.reddit.com/r/AskProgramming/comments/covckp/what_should_i_do_with_my_free_time/,What should I do with my free time?
147,covcyq,https://www.reddit.com/r/AskProgramming/comments/covcyq/where_to_host_simple_slack_app/,Where to host simple slack app?
148,coxwi2,https://www.reddit.com/r/AskProgramming/comments/coxwi2/arrays_assignment/,Arrays assignment.
149,coy95u,https://www.reddit.com/r/AskProgramming/comments/coy95u/how_to_play_separate_audio_and_video_streams_on/,How to play separate audio and video streams on the web?
150,coyey3,https://www.reddit.com/r/AskProgramming/comments/coyey3/where_do_you_see_the_future_of_data_going_as_far/,Where Do You See the Future of Data Going As Far As Databases: Relational vs Non-Relational Databases
151,cozd4c,https://www.reddit.com/r/AskProgramming/comments/cozd4c/cloud_technology/,Cloud Technology
152,cp0api,https://www.reddit.com/r/AskProgramming/comments/cp0api/framework_choice_for_creating_an_lcd_panel/,Framework choice for creating an LCD panel displaying drinks menu
153,cp0bud,https://www.reddit.com/r/AskProgramming/comments/cp0bud/program_that_can_visually_filter_out_data/,Program that can visually filter out data
154,cp0hb4,https://www.reddit.com/r/AskProgramming/comments/cp0hb4/lnk1168_error/,LNK1168 error
155,cp0qmt,https://www.reddit.com/r/AskProgramming/comments/cp0qmt/can_you_tell_me_how_you_would_write_a_unit_test/,Can you tell me how you would write a unit test for this function?
156,cp1640,https://www.reddit.com/r/AskProgramming/comments/cp1640/are_there_any_true_multiplatform_gui_libraries/,Are there any true multi-platform GUI libraries nowadays?
157,cp1bvv,https://www.reddit.com/r/AskProgramming/comments/cp1bvv/how_should_i_structure_a_simple_2048style_game_at/,How should I structure a simple 2048-style game at the highest level?
158,cp2i0e,https://www.reddit.com/r/AskProgramming/comments/cp2i0e/im_trying_to_find_the_website_where_programming/,I'm trying to find the website where programming advice is packaged as Taoist Parables
159,cp42hj,https://www.reddit.com/r/AskProgramming/comments/cp42hj/what_programming_knowledge_do_i_need_to_build_a/,What programming knowledge do I need to build a Gmail add-on?
