,post_id,post_url,post_title
160,cp4398,https://www.reddit.com/r/AskProgramming/comments/cp4398/managing_large_amounts_of_files_in_wpf_c_making/,Managing large amounts of files in WPF C# (Making Music Player for Self)
161,cp48s6,https://www.reddit.com/r/AskProgramming/comments/cp48s6/more_c_confusion/,More C++ confusion
162,cow6jj,https://www.reddit.com/r/javascript/comments/cow5n2/askjs_does_the_prototype_chain_as_opposed_to/,"Does JS's dynamic prototype chain (as opposed to ""classical"" class inheritance) offers any actual benefits?"
163,cowap9,https://www.reddit.com/r/AskProgramming/comments/cowap9/what_are_the_advantages_of_kotlin_over_java_and/,What are the advantages of kotlin over Java and what are the limitations?
164,cowf7i,https://www.reddit.com/r/AskProgramming/comments/cowf7i/what_is_the_dumbest_sentence_statement_or/,"What is the dumbest sentence, statement or otherwise you have heard from a non-programmer about programming?"
165,corjkq,https://www.reddit.com/r/AskProgramming/comments/corjkq/is_it_possible_for_someone_to_find_a_phone_number/,Is it possible for someone to find a phone number through Facebook if it’s not viewable?
166,corzeq,https://www.reddit.com/r/node/comments/copwuc/clean_application_architecture_load_testing_and/,"Clean application architecture, load testing, and code review for a production Node.js API. Advice needed."
167,cp16n7,https://www.reddit.com/r/learnjavascript/comments/cp0umt/help_with_recursive_function_to_delete_a_property/,Help With Recursive Function to Delete a Property From a Tree Object
168,cp2urn,https://www.reddit.com/r/AskProgramming/comments/cp2urn/why_do_electron_based_applications_add_colored/,why do electron based applications add colored pixels to text?
169,cm447f,https://www.reddit.com/r/AskProgramming/comments/cm447f/converting_aspx_file_to_pdf/,Converting .aspx file to pdf.
170,cm5ji4,https://www.reddit.com/r/AskProgramming/comments/cm5ji4/how_do_i_become_a_product_owner/,How do i become a product owner?
171,cm5kd5,https://www.reddit.com/r/AskProgramming/comments/cm5kd5/i_know_nothing_jon_snuh_but_want_something_done/,"I know nothing, (Jon Snuh) but want something done."
172,cm6jna,https://www.reddit.com/r/AskProgramming/comments/cm6jna/who_originally_created_git_for_windows_and_who/,"Who originally created git for Windows, and who maintains it now?"
173,cm7wl4,https://www.reddit.com/r/AskProgramming/comments/cm7wl4/what_skills_do_you_need_to_become_an_aimachine/,what skills do you need to become an AI(machine learning) engineer?
174,cma495,https://www.reddit.com/r/AskProgramming/comments/cma495/how_do_websites_detect_user_scripts/,how do websites detect user scripts?
175,cmc766,https://www.reddit.com/r/AskProgramming/comments/cmc766/im_looking_for_a_programming_language/,I'm looking for a programming language
176,cmc7k8,https://www.reddit.com/r/AskProgramming/comments/cmc7k8/twitch_oidc_authentication_question/,Twitch OIDC Authentication Question
177,cmceop,https://www.reddit.com/r/AskProgramming/comments/cmceop/how_do_websites_like_honey_gather_product/,How do websites like Honey gather product information?
178,cmdl5o,https://www.reddit.com/r/AskProgramming/comments/cmdl5o/any_good_code_review_resource/,Any good code review resource?
179,cmfft6,https://www.reddit.com/r/AskProgramming/comments/cmfft6/language_and_framework_for_webdevelopment/,Language and framework for Webdevelopment
180,cmi4xn,https://www.reddit.com/r/AskProgramming/comments/cmi4xn/question_on_python/,Question on Python
181,cmiz4s,https://www.reddit.com/r/AskProgramming/comments/cmiz4s/any_good_programming_side_hustles/,Any good programming side hustles?
182,cmizi2,https://www.reddit.com/r/AskProgramming/comments/cmizi2/creating_gamemodes_in_one_program/,Creating gamemodes in one program
183,cm4ekj,https://www.reddit.com/r/AskProgramming/comments/cm4ekj/what_design_patterns_are_important_to_be/,What design patterns are important to be successful in a programming interview?
184,cm5283,https://www.reddit.com/r/AskProgramming/comments/cm5283/question_is_there_a_commandline_tool_for/,Question: is there a command-line tool for converting html files to pdf?
185,cmao4x,https://www.reddit.com/r/AskProgramming/comments/cmao4x/if_im_making_a_videogame_in_c_current_game_state/,"If I'm making a videogame in C, current game state is a huge, complicated structure, storing positions and states of all objects, the map, the AI, etc. In Haskell, would I just wrap the entire thing in a State monad? Wouldn't it mean that the (huge) state is getting copied needlessly all the time?"
186,cmdkyl,https://www.reddit.com/r/AskProgramming/comments/cmdkyl/is_it_possible_to_build_a_desktop_app_as_a_local/,"Is it possible to build a desktop app as a local server plus a bared-down web browser window, using html+js for the GUI and something else for internal logic, wrapped up in a single executable? It sounds like something that could be useful, but I failed at googling anything like that"
187,cmg18s,https://www.reddit.com/r/AskProgramming/comments/cmg18s/what_language_or_framework_would_be_the_best/,What language or framework would be the best choice to create a multi client chat app?
188,cm8vu0,https://www.reddit.com/r/AskProgramming/comments/cm8vu0/im_a_beginner_in_programming_i_need_help_with/,"I'm a beginner in programming, I need help with dictionary in Python"
189,cm9u3a,https://www.reddit.com/r/AskProgramming/comments/cm9u3a/what_are_some_of_the_cool_programs_in_c_language/,What are some of the cool programs in C Language?
190,cmaze1,https://www.reddit.com/r/AskProgramming/comments/cmaze1/c_access_static_class_methods_by_a_string/,[C#] Access static class methods by a string
191,cmbgnw,https://www.reddit.com/r/AskProgramming/comments/cmbgnw/is_it_bad_practice_to_use_settimeout/,Is it bad practice to use setTimeout?
192,cqi89c,https://www.reddit.com/r/AskProgramming/comments/cqi89c/how_do_you_batch_build_in_visual_studios_mac/,How do you batch build in visual studios Mac?
193,cqi8wg,https://www.reddit.com/r/AskProgramming/comments/cqi8wg/database_global_state_therefore_global_state_is_a/,"database == global state, therefore global state is a valid design principle?"
194,cqmc40,https://www.reddit.com/r/AskProgramming/comments/cqmc40/printing_using_nodejs/,Printing using Nodejs
195,cqn2uf,https://www.reddit.com/r/AskProgramming/comments/cqn2uf/example_of_a_project_that_was_written_in_c_then/,Example of a project that was written in C++ then ported to C?
196,cqn8j9,https://www.reddit.com/r/AskProgramming/comments/cqn8j9/why_might_xcode_only_be_pushing_part_of_my/,Why might Xcode only be pushing part of my project to Github?
197,cqphs2,https://www.reddit.com/r/AskProgramming/comments/cqphs2/looking_for_some_hard_to_track_down_documentation/,Looking for some hard to track down documentation
198,cqpt22,https://www.reddit.com/r/AskProgramming/comments/cqpt22/i_dont_now_how_to_begin_with_programming/,I don't now how to begin with programming...
199,cqq2ju,https://www.reddit.com/r/AskProgramming/comments/cqq2ju/my_rest_resource_file_refuses_to_be_found/,My REST resource file refuses to be found
200,cqqlpb,https://www.reddit.com/r/AskProgramming/comments/cqqlpb/where_to_start_if_im_interested_in_ai/,Where to start if I'm interested in AI?
201,cqr2ec,https://www.reddit.com/r/AskProgramming/comments/cqr2ec/creating_a_web_application_in_ms_visual_studio/,"Creating a Web Application in MS Visual Studio and would like to start connecting to an Oracle Database to Test My Code, How Do I Get an Oracle Database on My Machine?"
202,cqrfv9,https://www.reddit.com/r/AskProgramming/comments/cqrfv9/need_guidelines_for_programming_language/,need guidelines for programming language
203,cqseor,https://www.reddit.com/r/AskProgramming/comments/cqseor/where_to_start_machine_learning_on_c/,Where to start machine learning on C#?
204,cqw1os,https://www.reddit.com/r/AskProgramming/comments/cqw1os/so_how_do_you_build_a_desktop_application/,So How Do you Build a Desktop Application?
205,cqwms3,https://www.reddit.com/r/AskProgramming/comments/cqwms3/i_want_to_create_a_bot_net_for_facebook_likes/,I want to create a bot net for Facebook likes
206,cqx9pl,https://www.reddit.com/r/AskProgramming/comments/cqx9pl/what_algoritms_execute_in_olog₂_n/,What algoritms execute in O(log₂ n)?
207,cqy7et,https://www.reddit.com/r/AskProgramming/comments/cqy7et/int_m_l_r_l_2_vs_int_m_r_l_2/,int m = l + (r - l) / 2 vs . int m = (r + l) / 2
208,cqph0l,https://www.reddit.com/r/AskProgramming/comments/cqph0l/c_list_typing/,[C#] List Typing
209,cqqo5e,https://www.reddit.com/r/AskProgramming/comments/cqqo5e/whats_a_line_of_code_that_looks_terribly/,Whats a line of code that looks terribly wrong/useless but absolutely finds its valid application?
210,cwwhpp,https://www.reddit.com/r/AskProgramming/comments/cwwhpp/for_all_you_backendfullstack_engineers_i_got_a/,For all you Back-end/Full-stack engineers. I got a couple of questions.
211,cwwzdv,https://www.reddit.com/r/AskProgramming/comments/cwwzdv/how_come_when_i_right_click_and_search_from_a/,"How come when I Right click and search from a particular site, and click one of the video results, Google closes right away?"
212,cwyr2c,https://www.reddit.com/r/AskProgramming/comments/cwyr2c/c_output_file_name_to_textbox/,C# - output file name to textbox
213,cwyuxg,https://www.reddit.com/r/AskProgramming/comments/cwyuxg/how_to_restrict_access_to_a_webpage_to_be_used/,How to restrict access to a webpage to be used only from office? (PHP/JS)
214,cwyzqe,https://www.reddit.com/r/AskProgramming/comments/cwyzqe/does_it_make_sense_to_compare_programming/,Does it make sense to compare programming languages?
215,cwzeyq,https://www.reddit.com/r/AskProgramming/comments/cwzeyq/question_on_fundamentals_of_programming/,Question on fundamentals of programming
216,cx029d,https://www.reddit.com/r/AskProgramming/comments/cx029d/preincrement_and_postincrement_in_c/,Pre-increment and Post-increment in C
217,cx1j3k,https://www.reddit.com/r/AskProgramming/comments/cx1j3k/header_function_declarations_local_to_file/,Header function declarations local to file
218,cx20ki,https://www.reddit.com/r/AskProgramming/comments/cx20ki/looking_for_feedback_on_how_developer_resources/,Looking for feedback on how developer resources could be improved!
219,cx2q5k,https://www.reddit.com/r/AskProgramming/comments/cx2q5k/looking_for_a_stock_market_api/,Looking for a stock market API
220,cx30zv,https://www.reddit.com/r/AskProgramming/comments/cx30zv/c_windows_cannot_find_command/,C# - windows cannot find command
221,cx34tz,https://www.reddit.com/r/AskProgramming/comments/cx34tz/help_creating_simple_executable/,Help creating “simple” executable
222,cx42he,https://www.reddit.com/r/AskProgramming/comments/cx42he/how_to_create_an_html_form_that_allows_ms_word/,How to create an HTML form that allows MS word type of formatting?
223,cx478d,https://www.reddit.com/r/AskProgramming/comments/cx478d/computer_science_prof_says_we_have_to_use/,"Computer Science Prof. says we have to use netbeans, can he tell if I use Eclipse?"
224,cx4c4x,https://www.reddit.com/r/AskProgramming/comments/cx4c4x/help_me_get_started_on_working_on_a_project/,Help me get started on working on a project!
225,cx5dg8,https://www.reddit.com/r/AskProgramming/comments/cx5dg8/i_dont_know_if_this_is_the_right_place/,I don't know if this is the right place
226,cx5krj,https://www.reddit.com/r/AskProgramming/comments/cx5krj/how_to_structure_code_that_contains_slightly/,How to structure code that contains slightly different logic for different customers?
227,cx5oy2,https://www.reddit.com/r/AskProgramming/comments/cx5oy2/whats_a_good_intermediate_level_c_book/,What's a good intermediate level C++ book?
228,cx5snv,https://www.reddit.com/r/AskProgramming/comments/cx5snv/need_some_advice_on_structuring_ai/,Need Some Advice on Structuring AI
229,cx69rw,https://www.reddit.com/r/AskProgramming/comments/cx69rw/expressjs_crossorigin_request_blocked/,Express.js - Cross-Origin Request Blocked
230,cx8kds,https://www.reddit.com/r/AskProgramming/comments/cx8kds/how_do_you_do_things_like_reserve_objects_if/,"How do you do things like reserve objects if you're using a nosql db like Cassandra? If 3 Uber drivers click accept on a single ride at once, how do you handle the race condition?"
231,cwwz92,https://www.reddit.com/r/AskProgramming/comments/cwwz92/hey_python_programmers_what_are_some_code/,Hey python programmers!! What are some code snippets you find suoer useful??
232,cwx29i,https://www.reddit.com/r/AskProgramming/comments/cwx29i/hey_front_end_developers_what_are_some_design/,Hey front end developers!! What are some design practices you use very often?
233,cx24w9,https://old.reddit.com/r/cscareerquestions/comments/cx205p/my_company_is_giving_us_a_hack_day_to_build/,"My company is giving us a hack day to build whatever we want, but what we produce has to have some sort of benefit to the company. What are some ideas that my team can produce?"
234,cx6yf0,https://www.reddit.com/r/AskProgramming/comments/cx6yf0/met_up_with_an_old_buddy_hes_working_on_self/,"Met up with an old buddy, he's working on ""self correcting software"" (his words). I know nothing of this specialization. Is there any relevant software or hardware that I can get him as a gift? He likely does not want books/courses."
235,cwy263,https://www.reddit.com/r/AskProgramming/comments/cwy263/vbanet_passing_user_input_into_command/,VBA.net - passing user input into command
236,cwy28q,https://www.reddit.com/r/AskProgramming/comments/cwy28q/need_some_advice_to_start_my_career_in_either_web/,Need some advice to start my Career in either Web Development or Mobile app Development.
237,cx00bl,https://www.reddit.com/r/AskProgramming/comments/cx00bl/need_help_figuring_out_inconsistency_in_my_code/,Need help figuring out inconsistency in my code. What am I missing?
238,cx5gxo,https://www.reddit.com/r/AskProgramming/comments/cx5gxo/programming_careers_that_have_nothing_to_do_with/,Programming careers that have nothing to do with HTML and CSS
239,cx5x6p,https://www.reddit.com/r/AskProgramming/comments/cx5x6p/how_do_i_prevent_createreactapps_npm_start_from/,How do I prevent create-react-app's `npm start` from deleting the `paths` property from tsconfig.json?
240,ckx1x4,https://www.reddit.com/r/AskProgramming/comments/ckx1x4/idk_if_this_is_a_place_to_ask_this_but_i_need/,Idk if this is a place to ask this but I need help with an assembly programming I am writing and I am running out of time
241,ckz8eq,https://www.reddit.com/r/AskProgramming/comments/ckz8eq/is_there_an_api_that_will_link_you_to_an_app_for/,Is there an API that will link you to an app for payment?
242,ckzihd,https://www.reddit.com/r/AskProgramming/comments/ckzihd/javascript_programmers_would_something_like_this/,"JavaScript programmers: would something like this be possible, and if so, how much would it cost me to have a coder create it for me?"
243,ckzwma,https://www.reddit.com/r/AskProgramming/comments/ckzwma/help_with_python_project_on_word_search/,Help with Python project on word search
244,cl0dmz,https://www.reddit.com/r/AskProgramming/comments/cl0dmz/graduated_from_community_college_feel_more_lost/,Graduated from community college &amp; Feel more lost than when I started.
245,cl1bze,https://www.reddit.com/r/AskProgramming/comments/cl1bze/final_year_project/,Final year project
246,cl1m4t,https://www.reddit.com/r/AskProgramming/comments/cl1m4t/java_to_python/,Java to Python
247,cl2qmk,https://www.reddit.com/r/AskProgramming/comments/cl2qmk/what_is_the_best_library_for_parsing_and/,What is the best library for parsing and generating EDI X12?
248,cl2wrt,https://www.reddit.com/r/AskProgramming/comments/cl2wrt/is_there_a_good_way_to_share_small_amounts_of/,Is there a good way to share small amounts of data between 2 or more processes?
249,cl3jd6,https://www.reddit.com/r/AskProgramming/comments/cl3jd6/how_do_i_plug_inimplement_a_python_script_for/,How do I plug in/implement a Python script for MacOS iBooks?
250,cl4tu2,https://www.reddit.com/r/AskProgramming/comments/cl4tu2/im_trying_to_learn_to_build_a_website_template/,"I'm trying to learn to build a website template using CSS Grid, can you tell me why my header isn't filling in its container?"
251,cl5stx,https://www.reddit.com/r/AskProgramming/comments/cl5stx/code_reviews/,Code Reviews
252,cl613y,https://www.reddit.com/r/AskProgramming/comments/cl613y/this_is_kind_of_a_dumb_question_but_how_does/,"This is kind of a dumb question, but how does javascript not get the ""number"" confused?"
253,cl6f14,https://www.reddit.com/r/AskProgramming/comments/cl6f14/android_app_in_js/,Android app in JS
254,cl6kv1,https://www.reddit.com/r/AskProgramming/comments/cl6kv1/is_it_well_defined_behaviour_to_override_a_custom/,"Is it well defined behaviour to ""override"" a (custom) CMake function via include files?"
255,cl8arz,https://www.reddit.com/r/AskProgramming/comments/cl8arz/what_are_your_biggest_everyday_struggles/,What are your biggest everyday struggles?
256,cl99jq,https://www.reddit.com/r/AskProgramming/comments/cl99jq/is_my_assumption_wrong_about_two_algorithms_or/,Is my assumption wrong about two algorithms or simply my approach?
257,clbino,https://www.reddit.com/r/AskProgramming/comments/clbino/python_boolean_values/,Python Boolean Values
258,clbkyp,https://www.reddit.com/r/AskProgramming/comments/clbkyp/lisp_programmers_is_there_actual_use_of_lisp_in/,"Lisp Programmers: Is there actual use of Lisp in industry? How do you use it at your work? How do you overcome the ""Lisp quirks""?"
259,clbp7m,https://www.reddit.com/r/AskProgramming/comments/clbp7m/how_would_you_recreate_this_testimonial_using_css/,How would you recreate this testimonial using CSS Grid?
260,cl3qu6,https://www.reddit.com/r/AskProgramming/comments/cl3qu6/my_caret_ide_for_chromebook_shows_red_x_marks_by/,"My caret IDE for chromebook shows red ""x"" marks by the line number when it thinks I've made a mistake. What is this feature called and how do I disable it?"
261,cl8toc,https://www.reddit.com/r/AskProgramming/comments/cl8toc/as_a_beginner_would_learning_a_functional/,"As a beginner, would learning a functional programming language first make you a better programmer when learning a ""traditional"" language like C?"
262,cl88jo,https://www.reddit.com/r/AskProgramming/comments/cl88jo/lamp_php_and_bash/,"LAMP, php and bash"
263,cl932v,https://www.reddit.com/r/AskProgramming/comments/cl932v/c_json_serialization/,[C#] Json Serialization
264,cobkn2,https://www.reddit.com/r/AskProgramming/comments/cobkn2/need_to_write_an_automation_script_in_ruby/,Need to write an automation script in Ruby
265,cod3j9,https://www.reddit.com/r/AskProgramming/comments/cod3j9/why_isnt_fontface_working_here/,Why isn't @font-face working here?
266,cofj40,https://www.reddit.com/r/AskProgramming/comments/cofj40/need_help_creating_a_script_to_sync_windows_clock/,Need help creating a script to sync windows clock to the internet time zones
267,cog143,https://www.reddit.com/r/AskProgramming/comments/cog143/mongodb_query_help/,MongoDB Query Help
268,cogd8s,https://www.reddit.com/r/AskProgramming/comments/cogd8s/what_isnt_my_css_working/,What isn't my CSS working?
269,coh9ir,https://www.reddit.com/r/AskProgramming/comments/coh9ir/how_to_transfer_data_between_c_client_and_c/,How to transfer data between C++ client and c# service
270,cok2gu,https://www.reddit.com/r/AskProgramming/comments/cok2gu/looking_for_help_in_consulting_project_about/,Looking for help in consulting project about procrastination
271,cokml7,https://www.reddit.com/r/AskProgramming/comments/cokml7/not_so_much_a_programming_question_more_an/,"Not so much a programming question, more an industry one. Hope this is okay here. I just started my first full time software dev job out of university. It’s a well known, large corporate consulting firm. The project I’m on is cool, but they are already asking me to work weekends, 2 weeks on."
272,cokomm,https://www.reddit.com/r/AskProgramming/comments/cokomm/automatically_checking_coding_style/,Automatically checking coding style
273,cokvgx,https://www.reddit.com/r/AskProgramming/comments/cokvgx/books_about_programming_that_arent_learning/,Books about programming that aren't learning resources.
274,col5su,https://www.reddit.com/r/AskProgramming/comments/col5su/discord_bot_linked_to_facebook_calendar/,Discord Bot Linked To Facebook calendar
275,comeu7,https://old.reddit.com/r/Python/comments/com11x/is_full_stack_developer_a_concept_only_in_the_web/,"Is ""Full Stack Developer"" a concept **only in the Web Dev domain** ?"
276,conmba,https://www.reddit.com/r/AskProgramming/comments/conmba/a_girl_on_tinder_i_was_super_into_and_was_having/,A girl on Tinder I was super into and was having a great conversation with ghosted me the next day. Is there ANY way (using the api or otherwise) to see previous matches?
277,cof2gh,https://www.reddit.com/r/AskProgramming/comments/cof2gh/secrets_to_get_high_score_in_sas_base_programming/,Secrets To Get High Score in SAS Base Programming (A00-233) Certification
278,cq2710,https://www.reddit.com/r/AskProgramming/comments/cq2710/we_have_a_research_project_and_working_over/,We have a research project and working over sensoring paper and material waste materials and segregating them.
279,cq2r1k,https://www.reddit.com/r/AskProgramming/comments/cq2r1k/does_such_an_open_source_project_as_a/,"Does such an open source project as a ""presentation terminal"" exist? If not, what's the easiest terminal to fork to make one?"
280,cq2xcb,https://www.reddit.com/r/AskProgramming/comments/cq2xcb/will_ican_i_use_my_own_laptop/,Will I/can I use my own laptop?
281,cq59cq,https://www.reddit.com/r/AskProgramming/comments/cq59cq/what_are_the_different_ways_i_can_use_to_make/,What are the different ways I can use to make responsive text / font-size?
282,cq6q4f,https://www.reddit.com/r/AskProgramming/comments/cq6q4f/for_loop/,For loop
283,cq8xut,https://www.reddit.com/r/AskProgramming/comments/cq8xut/companies_that_offer_onsiteondemand_courses_for/,Companies that offer on-site/on-demand courses for developers?
284,cq9ujc,https://www.reddit.com/r/AskProgramming/comments/cq9ujc/when_to_use_react_vs_js_object_constructor/,When to use React vs JS object constructor functions
285,cqbm3p,https://www.reddit.com/r/AskProgramming/comments/cqbm3p/is_this_batch_file_safe/,is this .batch file safe?
286,cqdg5n,https://www.reddit.com/r/AskProgramming/comments/cqdg5n/php_exec_problem/,[PHP] exec() problem
287,cqeduv,https://www.reddit.com/r/AskProgramming/comments/cqeduv/code_doesnt_work_c/,Code doesn't work (C++)
288,cqera0,https://www.reddit.com/r/AskProgramming/comments/cqera0/which_compiler_should_i_get/,Which compiler should I get?
289,cqf89v,https://www.reddit.com/r/AskProgramming/comments/cqf89v/is_there_a_saas_that_makes_it_easysimplifies/,Is there a SaaS that makes it easy/simplifies writing custom scripts for lay people?
290,cqfb76,https://www.reddit.com/r/AskProgramming/comments/cqfb76/looking_for_beginner_programmerswebdevelopers_in/,Looking for beginner programmers/web-developers in NYC!!!
291,cqhke4,https://www.reddit.com/r/AskProgramming/comments/cqhke4/desperate_need_of_help_data_being_sent_between/,Desperate need of help! Data being sent between arduino and java on PC.
292,cqhrzq,https://www.reddit.com/r/AskProgramming/comments/cqhrzq/python_q_what_happens_to_objects_outside_of_the/,"Python Q: What happens to objects outside of the function they were initialized in? Also, what does ""del"" do on a low level?"
293,cqhwo6,https://www.reddit.com/r/AskProgramming/comments/cqhwo6/is_there_a_system_or_best_practice_for_organizing/,Is there a system or best practice for organizing a CSS stylesheet? So far I've only been styling single pages but now I'm building multi page sites.
294,cq1tsm,https://www.reddit.com/r/AskProgramming/comments/cq1tsm/how_do_i_start_programming_with_sensors/,How do I start programming with sensors?
295,cqcy6r,https://www.reddit.com/r/AskProgramming/comments/cqcy6r/a_recent_software_engineering_graduate_from_india/,A recent software engineering graduate from India. Need help to get into FAANG companies. Don't have the necessary finances for hardware upgrade
296,cqezyq,https://www.reddit.com/r/AskProgramming/comments/cqezyq/which_languageprogram_should_i_use_to_easily/,"Which language/program should I use to easily achieve a portable, one-file program, that can hold all the assets, display pictures with transparrency, and do calculations based on an external file?"
297,cqhjco,https://www.reddit.com/r/AskProgramming/comments/cqhjco/how_do_i_edit_an_included_js_file_with_chrome/,How do I edit an included JS file with chrome debugger tools?
298,clc9di,https://www.reddit.com/r/AskProgramming/comments/clc9di/python_regex_giving_unwanted_results_when/,Python - regex giving unwanted results when converting between text formats
299,clcrm6,https://www.reddit.com/r/AskProgramming/comments/clcrm6/whats_this_asking/,Whats this asking?
300,clczrb,https://www.reddit.com/r/AskProgramming/comments/clczrb/utterly_stuck_one_hurdle_from_completing/,"Utterly stuck, one hurdle from completing University"
301,cldehq,https://www.reddit.com/r/AskProgramming/comments/cldehq/high_performance_jdbc_connection_pooling_with/,High Performance JDBC Connection Pooling with Oracle Database
302,cle0fh,https://www.reddit.com/r/AskProgramming/comments/cle0fh/any_chance_a_hackerrank_interview_hiring_test/,Any chance a HackerRank interview hiring test question could be unsolvable?
303,clg6lr,https://www.reddit.com/r/AskProgramming/comments/clg6lr/is_it_possible_to_get_a_hold_of_the_reddit_api_if/,"Is it possible to get a hold of the Reddit API? If so, do you think I can add to it?"
304,clgn5j,https://www.reddit.com/r/AskProgramming/comments/clgn5j/what_should_i_use_for_writing_a_json_to_video/,What should i use for writing a JSON to video converter?
